,Komentar
0,keras seksual definisi tuju korban logika nolak lawan keras seksual definisi keras seksual
1,dekat zinah atur pasal dl sat demokrasi tdak layak isi penting tingi maslahat masyarakat jadi tameng oknum keras seksual mengunakan media skrang bicara bicara sembarang
2,law is art rinci gampang belok
3,tetap keras seksualitas
4,cocok terap dikemendikbud dpr
5,pakai anak sekolah mahasiswa rok lutut ganti tri bubar
6,korban ragu lapor usul lindung hukum korban polemik pdhal tingal revisi maf diusulkn partai gmn kbrnya
7,presenter suka motong cakap nara sadar
8,ormas islam dukung permedikbudristek keras seksual tolak pasal ayat tuju korban permendikbud nadiem hilang tuju korban
9,negara kacau jabat nyeleneh coba urus subtantif
10,tri nadiem pecat
11,ranah mendikbud iya keras seksual iya ranah menteri perempuan anak
12,permendikbud bnr revisi laksana
13,bicara idiologi sbg muslim fakta terima bicara pojok islam islam islam kotak amal anjur sedekah kbetulan mreka sesat adl saudara muslim mjd isue ksalahan mreka iya ksalahan pnegak hukum adl brsama dhadapi brsama mnertibkan muslim pemahamanya sesat dr sedikit mbahas syurga sbg imbal neraka sbg hukum lbh bahas adl mngenali tuhan konsekuensi mnganut agama brarti mngabdi tuhan mpertahankan imej mngejar syurga
14,aduh atur keras sexual atur penzinahan ini beda tuju korban tuju keras sexual
15,kalimatx difahami tuju korban undang bahasa indonesia bnr kayakx namax korban iya tuju unsur tuju namax oknum korban namax kalimat seharusx revisi hilang kalimat debat kalimat tuju tuju korban bnr
16,degradasi moril
17,zinah haram tuju lawan
18,anehny negeri
19,coba deh tuju permen pasal korban ancam tindak keras seksual tsbt dasar suka suka trus laku ngak kena permen kampus kena pasal tindak a susila trus kena sypa korban laku
20,definisi buat dlm keras seksual definisi iya tuju korban logika wajar kalimat cantum
21,dmitri senang mesum marah permendikbud colek raba raba sangsi buka baju melangar moril kuhp
22,muhamad thohir oke permendikbud bentrok pornografi lai
23,suka suka seks bebas patuh permendikbud membolehkanya
24,dmitri pasal bentrok coba sebut memeng erti ikut ulama kadron
25,dmitri isi otak mesum ulama kadron dalem permendikbud
26,muhamad thohir contoh kuhpnya tubuh suami istri pidana zan pidana penjara denda katagori permendikbud sentuh usap raba pegang peluk cium mengosokan tubuh tubuh korban tuju korban buka pakai korban tuju korban kuhp nyata gamblang ambigu multitafsir sex bebas larang permendikbud dapat seksual tuju korban cium esek malu syah syah implementasi permendikbud bentrok kuhp salah kuhp permendikbudnya ambigu revisi
27,dmitri anak hukum tertawa argumen kutip salahsatu pasal kontroversial pasal ayat keras seksual ayat liput sentuh usap raba pegang peluk cium mengosokan tubuh tubuh korban tuju korban simpul gamblang permendikbud kelompok tindak tindak tuju korban tindak tuju korban tindak tuju korban keras seksual tindak tuju korban ada keras seksual permendikbud samasekali atur tindak tuju korban legal meng ilegal alias iya atur samasekali anak hukum tertawa argumen kutip salahsatu pasal kontroversial pasal ayat keras seksual ayat liput sentuh usap raba pegang peluk cium mengosokan tubuh tubuh korban tuju korban simpul gamblang permendikbud kelompok tindak tindak tuju korban tindak tuju korban tindak tuju korban keras seksual tindak tuju korban ada keras seksual permendikbud samasekali atur konsekwensi tindak tuju korban legal ilegal alias atur samasekali argumentum contrario pikir tindak tuju korban boleh dalem pemendikbud simpul ga dasar
28,dewanga putera oke frase tuju korban frase faham peraturanya timbul polemik multitafsir kontradiksi kuhp a susila lai bentrok nama korban tuju leceh literatur bahasa indonesia korban nama frase tuju korban dampak oknum memanfatkan frase alesanya korban kbi binatang derita mati akibat jadi buat jahat
29,ada korban tuju
30,deh mesti menrisex atur timbul gaduh mknya makul moril agama kasih agama rohani hapus
31,kuad in ok
32,kuad in plis deh agama sekolah kampus leceh seksual
33,gabriela indah charista yes very very very true
34,tuju bang baca peraturanya bacod permendikbud dijelasin tuju korban ayat huruf huruf huruf huruf huruf huruf diangap syah dalem korban alami situasi laku ancam paksa menyalahgunakan kedudukanya
35,tuju laku laku ancam
36,baca iya paham konsep consent ga tuju ga tuju mulut baca bicara
37,dewan permen jk moral bejad buk jk keluarga tanam moril agama rasa kendali agama apa larang zan jk perkosan mk laku lapor polisi ibuk dewan jk alesanya suka suka
38,vissi miss presiden tri jabar dlm bijak revolusi mental jokowi
39,tuju korban ganti hapus
40,sempat goreng gosong jokowi jatuh
41,segalasesuatu serah ahli tungu kehancuranya
42,host las ganti bicara
43,sentuh haram ikut hukum islam alah swt atur atur hdp
44,logika rakyat indonesia larang bawa senjata tajam bawa senjata api
45,enak bgt suka suka ga main kampus
46,pks engkau harap rakyat indonesia
47,suka suka wilayah private perkara moril individu didik mora
48,terap atur zinah perkosan entar atur terap olah izin perempuanya inget negara panca sila sila tuhan maha esa perempuanya tuju ga tuju syah pasang iya mesti larang tri agama ngedukung negara negara panca sila sila mna terap
49,atur laksana atur tat atur tat syariat
50,harus tungu korban simak penyelesaianya adil bnr
51,polemik timbul gaduh onar
52,pks cman gaduh alih isu godbener jekartah angota par tainya masalah formula usut kpk
53,sanak keluarga pks korban keras seksual dukung laku tuntut laku
54,hahaha pks waswas angotanya garuk permen dalih
55,lanjut tri permendikbudristek robah iya tungu
56,trgantung anak ortunya penring tua mndidik anak ahklak utama tr bukti kjadian tua ketat anak trjerumus orunya anak selamat tr hindar pr gaul bas anak cewek alhamdulilah tamat kuliah bidan dua trlepas prgaulan bebas inti nasip rizqi anak buat tua mnyikapi kasih makan jlan halal koropsi so oasti dampak anak salah anak renung oke tua ahklak cari jlanya rizqi
57,miris bgt gas
58,hukum logika tsb bnr undang undang atur senjata tajam atur senjata api kesimpulanya senjata api boleh argumentum contrario
59,dewanga putera atur advokasi legal hukum luas atur inti kait legalitas perzinahan konsensual kampus terbit permendikbud legalisasi ilegal
60,muhamad hashirama atur legal coba buka gogle baca azas legalitas dalem hukum atur larang buat diangap legal
61,suka suka buat jah undang aturanya klu suka suka keras
62,kuhp tubuh suami istri pidana zan pidana penjara denda katagori
63,permendikbud banyak lapor darurat bikin perendikbud badan hukum keras seksual slama realita jadi korban slalu rugika dalem lapor lindung leceh
64,istri anak tuju gaul keras sexual
65,ridwan basuki selingkuh kena pasal kuhp pemerkosan kena pasal kuhp prostitusi kena pasal kuhp atur dalem permendikbud dikti pasal jahat tentu hukum tuntut muat dalem pasal keras seksual verbal keras seksual non penetrasi intip body shaming tindak grepe grepe permen hadir dalem sebar photo vidio pribadi ijin kerab jadi korban pidana dengar pola fikir politikus pks golong mesum
66,ridwan basuki dalem pasal kuhp korban laku keras seksual pidana seksual dasar suka suka permendikbud korban kena sanksi hukum laku
67,breakpoint tv butuh narasi lebar butuh hapus tuju korban titik permendikbud ok susah hapus
68,ridwan basuki tuju sex bebas larang pemerkosan boleh
69,ridwan basuki hapus bedan pasal kuhp atur
70,breakpoint tv menrisex angaran keluar alesanya hasil teliti
71,indra menrisex payung hukum deh gak percaya hukum perkosa hukum kebiri makul moril agama kampus hilang jk tuju tuk hindar pemerkosan
72,pks lacur suka suka hukum beda suka lacur hukum neraka paksa salah korban rugi suka suka untung
73,undang undang poligami pks tuju duluan
74,tujuanya cegah keras seksual goreng legal zan otak pks bersih usia tumpul iya otak politis pks dosen jahat kelamin kebiri rajam dunia didik tingi rendah suara rektor lagak dungu dungu tempel nempelkan anu nadim ngurusin begitu pikir bijak mutu guru tingi urus kasih pks pegang pintu syurga
75,tuju permendikbud oke poin pasal ayat kontro versi timbul multi tapsir direfisi direfisi
76,merinding dgr sek boleh anak gadis moga jauh buat keji dn boga hati putih alah anak perkosa pacar hamil malu malu bertagung jawap cicip eak pacar bendigan putusin
77,suka suka paksa diangap suka sngt khawatir
78,maksud rancang pasal perkosa isteri rame buka zinah logika salah
79,inti klu mui larang mk permen hpus
80,pernyatan seksual non konsensual rubah seksual konsensual pernyatan invalid membuktikanya tabel benar seksual konsensual baca seksual non konsensual seksual konsensual mari tabel benar catat proposisi bnr proposisi salah tabel benar lihat baris tabel benar bnr baris syg baris salah pernyatan bnr konklusi ambil salah simpul pernyatan seksual non konsensual seksual konsensual pernyatan invalid
81,partai keras seksual
82,pks tolak atur bnr lanjut
83,do a rakyat indonesia moga libat dalem atur setan alami anak isteri selingkuh hamil dasar atur perintah legal iya alah perintah jokowi kehinan amin
84,main tafsir
85,kesan publik timbul polemik timbul prasangka tuk alih isu sdg rame
86,hancur moral zinah legal
87,abai pks
88,asalamualaikum maf permendikbudristek ditandatangani mendikbudristek frase tuju korban dalem pasal maf anda mahasiswa cium mahasiswi tutup kampus mahasiswi tuju buat tahu lai buat pelangaran tindak lanjut permendikbudristek
89,muantab skrng main kampus aman saudara laki laki sis slama pade nga ngas gas bwahahaha
90,inget mas tri atur hati hati kuatir jk atur tentang atur alah mk tuai adzab dunia akhirat
91,tuju giat esek keras pemaksan seksual iya brenti situ ga tolak pzinan paksa zan tuju ga cegah zinah tentang
92,dlm tuju cegah fisi tg keras seksual gak salah ayat tafsir gak tempat dlm permendikbud
93,ambigu sex bebas suka suka korbanya
94,bagus baik salah
95,do a mu jahat rakyat indonesia
96,umu nayla pasal boleh sex suka suka permebdikbud atur keras seksual legal perzinahan lindung perempuan jahat seksual dosen guru ustadz senior dl lingkung didik pake logika benci buta mata
97,gabriela indah charista dukung atur setan dalem do a umat islam
98,umu nayla wkwkw iya deh
99,marak urus tentang bngt coba terap kena tangkap
100,indra menrisek permen anehny mesti permen didik nasional maju cerdas rata wilayah indonesia
101,legal permendikbudristek ranah tangan tindak a susila keras seksual a susila tuju belah atur tangan
102,julidz atur saudara laki laki tahu zinah hukum indonesia salah laku ikat kawin gak laku dua single delik adu proses adu suami isteri alias pasang syah salah laku tera pasal kuhp
103,julidz rancang kuhp luas atur zinah bentuk tahu kuhp pasal teman teman sekulib protes cpt sahkan atur permendikbud gak ribut kaum kons kaum islamis gak capek ribut melulu
104,akhsan andi bang pasal zan ikat prostitusi lap lindung anak korbanya mas bawah umur nasional single propinsi kota hukumanya denda penjara iya nanangin tindak a susila zinah nangin keras seksual korban dalem paksan mikir legalin zinah konteks beda zinah gabisa single agama larang tau ngelarang zinah atur agama islam maksud ketentuanya islam gatau agama ngelarang beda konsep
105,akhsan andi iya nasional atur propinsi kota ambil contoh tangsel kota ga salah kena denda juta tahu a susila kamar penjara ulang surat perjanjianya
106,iya gantung daerah atur tindak a susila gak daerah atur daerah mayoritas muslim tahu iya ralat salah permendikbud islamis tuju keras seksual buat benar maksud permendikbud celah permendikbud manfatkan maf maf ayam kampus legal standing
107,udahlah gak debatin gak ngubah posisi belah lihat twiter uji materi permendikbud ma iya lihat depa
108,akai ondom elalu
109,ngak tindak pemendikbud tindak kuhp pasal
110,sus tri andarwati mekanisme hukum payung hukum gk jerat laku tindak a susila
111,julidz sebut kuhp pasal
112,sus tri andarwati itu rancang bu syah suruh teman teman sekulib protes kuhp cpt syah muncul atur atur permendikbud gak muncul polemik kaum sekulib kaum islamis
113,akhsan andi teman
114,sus tri andarwati gak teman teman sekulib oke bu rkuhp jalan tekan
115,akhsan andi sekulib kuhp aju perintah perintah lindung negara buat zinah mendikbud dukung perintah nama bantu presiden ga klausal mendikbud legal zinah
116,sus tri andarwati nama rkuhp sahkan gak ikat komentar olah rkuhp pasal jerat laku perzinahan ikat kawin single
117,akhsan andi iya rubah kenyat perintah aju usaha selesai kuhpnya perintah usaha melundungi negara buat zinah trus hubunganya permendikbud dilegalkanya zinah permendikbud zinah larang larang zinah sat syah permendikbud
118,sus tri andarwati ikat salah laku ikat kawin delik adu proses pasang syah salah laku ngadu
119,sus tri andarwati iya perintah mangkrak alias sahkan payung hukum tindak laku perzinahan luas permendikbud bnr gak zinah sex bebas protes kaum islamis frase tuju
120,sus tri andarwati permendikbud revisi iya kaum islamis legowo permendikbud
121,akhsan andi halah ga solusiable spk agamais diem leceh pesantren didik keluarga kena nikahin laku leceh keluarga korban maklum pikir tertingal bobrok
122,raja bla bla bla mucho texto nikmatin seteru wkwkwkwk
123,akhsan andi menrisex permen laku dunia didik
124,ente bicara ente pernyatan
125,akhsan andi frase tuju tuju leceh
126,aduh males bahas komen bales
127,hehehe penting tuju tuju
128,prbuatan zinah deh aturany sndri kuhp hukum agama msing komen kyak bocah paud deh gede blon
129,wongemblung neng ye udeh bebas main kampus hemat saudara laki laki ga hotel lindung negara bwahahahah
130,rush day iya gni toge dksih otak main hp goblokny natural
131,juli yaelah cuan tukang ecer kond kampus gas stock banyakin ahahaha
132,rush day trnyta drone kelas paud ngoceh
133,setujuj pakek pakean pantai jos brow
134,juli kadrun cerdas megunakan akal sehat gak permen nyuri sempat permen berani manusia moral berahlaq tat agama gak ayo ikut perintah agama tingalkan larang agama brow
135,atur alah dilangar laku keras seksual keras seksual atur manusia
136,senjata beda mas senjata berantas kuhp bahas tindak a susila
137,nila titik rusak susu belanga pasal revisi liberal halal penzinahan
138,nadiem kurikulum kanya tambah ajar sex bebas rayu lacur hukum negara mjd korban atur atur
139,rasuk
140,simak
141,revisi gus dur repot
142,muhamadiyah ikadi mui prof cholis naf tolak suruh pergi permendikbudristek th nu suara iya wakil prof cholil naf
143,pks poligami turun
144,negara truskan anak hasil zinah bagus dimcok
145,kalang guru tingi gak nolak zina atur tri
146,cecep bicara
147,klu selangkang pks cpt tangap
148,pks kritik permen bnr lanjut mas tri
149,inget angota pks nonton porno sidang bwahaha pks bela keras rem mpret urusin kader mu kampanye poligami ngak perempuan terima poligami diskusi cari sensasi jalan unya cpt tindakanya jalan amat revisi kakehan ngoceh
150,legal zinah jepang
151,aborsi efek hamil luar nikah
152,atur bnr keras seksual lawan dibrantas
153,tanda jaman naudzubilah
154,inalilahi wa inalilahi roji un
155,moga oengagas anak istri korban plaku zinah sek bas amin
156,mas mah beda beda senjata keras seksual lingkung kampus tembak pake permendikbudristek bicara tindak seksual tuju belah kampus tindak a susila pakek atur atur kampus atur larang tindak a susila kampus kode etik dosen laku dosen kuhp senjata sesuai permendikbudristek gk tindak laku a susila ranah mekanisme hukum patokanya nangkepnya bincang bahas luar konteks
157,korban ancam bicara dasar suka suka trus penjara korban
158,usul
159,pks revisi nungu korban tambah selese
160,rifki fauzi iya kelam gilir ngusulin kritisi
161,bnr
162,saudara laki laki urus ginian pks ga nyampe nalar tertawa oposisi payah lelet
163,tuju
164,indonesia maju kaya jepang ga islamabad belakang
165,riza kun kena azab
166,xmbelgedesh mitos gaung kelompok pondasi khayal bnr teori bukti banding negara negara
167,riza kun paham panca sila buka blue silah pimpin kawan dahulu materi drpd pondasi
168,xmbelgedesh ga faham panca sila kadrun iya make argumen tuhan atur hukum agama hukum praktis idiologi hukum syariat kaya arab panca sila kaya indonesia iya mengunakan panca sila bank konvensional ilegal qur riba haram injil ursury haram tetep ga ilegal idiologi demokrasi agama dosa urus urus negara meng ilegalkanya negara demokrasi syariat panca sila demokrasi syariat moga erti iya drun
169,pasal sebab aborsi permendikbud cegah tangan keras seksual giring legal zinah
170,zinah legal tanda kiamat
171,nti haml dluar nikah buru nikah siri ikut celeng benar bel pkoknya ikut fatwa partai lurus wakl ketua mui los krna mreka mrasa kuat bkuasa silah apadaya rakyt sbg rakyt hak bdoa bnar smoga anak cucu isteri mreka laku korban sek bas hamil brulang dluar nikah ga jlas mnghamili isteri mreka ga malu mlakukan sek bas dpan mreka skalipun nti patuh
172,dewi sriyati ngedongeng bu kyknya gk faham bahas tau teriak dukung teriakin gak faham substansi bicara ckckck
173,dewi sriyati kasi kalah debat serang personal paham makan berita goreng
174,gak aborsi larang rekomendasi dokter
175,logika liar ga sex bebas iya ga moril nyalahin permen
176,dukung sepenuh syarat frase tuju korban hapus permendikbud bentrok atur undang a susila nama korban korban tuju laku keras seksual suka suka sex bebas legal permendikbud kontra a susila lai situ permasalahanya
177,keras lembut syah cegah inget sila tuhan maha esa atur agama utama
178,dian chanel agama saudara laki laki
179,buka wafat nabi muhamad kategori jaman nabi wafat hinga depan msk jaman
180,lho memang dukung laku keras seksual nyata salah
181,kalimat tunjuk zinah legal permendikbud bu
182,amin
183,nyumpahin gin ngucap
184,muhamad dzulfiqar ok mengangap permendikbudristek gak legal zinah permendikbud ditandatangani mendikbudristek maf anda mahasiswa cium mahasiswi tutup kampus mahasiswi tuju buat tahu lai buat dalem pelangaran tindak lanjut permendikbudristek
185,muhamad farhan atur cegah tangan keras seksual atur tindak a susila kampus beda tuju korban hukum tindak a susila larang tuju hapus korban tindak keras seksual hukum diamenyetujui tindak lindung korban hukum tindak a susila larang korban keras seksual libat dalem tindak a susila tuju buat korban pemaksan hukum laku keras seksual
186,asalamualaikum muhamad dzulfiqar iya permendikbudristek permen tangan cegah seksual maf iya permendikbud frase tuju korban dalem pasal mahasiswa cium bibir mahasiswi pacar mengosokan kelam mahasiswi pacar tutup kampus mahasiswi pacar tuju buat tahu pelangaran gak ditindaklanjuti mahasiswi pacar tuju permendikbudristek beda mahasiswi pacar gak tuju pelangaran tindak lanjut permendikbudristek maf jahat keras seksual akibat buat tindak seksual tentang nilai norma nilai norma agama akar keras jahat seksual trmksh wasalamu alaikum
187,muhamad farhan permnedikbudristek ulang fokus tangan cegah keras seksual latar banyak keras seksual selesai adil korban keras seksual kampus penyelesaina lindung korban permendikbudristek selesai keras seksual kampus studi tindak keras seksual tindak a susila bicara keras korban korban rugi laku sebab rugi tuju tindak korban laku tindak a susila kampus kode etik kampus kait tindak a susila kuhp lindung anak cerita permendikbudristek tuju atur tindak a susila lingkung kampus beda letak legal zinah atur
188,asalamualaikum muhamad dzulfiqar maf kuhp zinah syah maf saudara anda mahasiswa cium bibir mahasiswi pacar mengosokan kelam tubuh mahasiswi pacar tutup kampus mahasiswi pacar tuju tahu lai buat mahasiswa pelangaran tindak lanjut permendikbudristek maf saudara kuhp perzinahan syah
189,muhamad farhan permendikbudristek atur tangan cegah keras seksual kampus atur tindak a susila kampus lahir latar atas studi pandang atas atur tindak a susila indonesia permendikbudristek legal zinah
190,asalamualaikum muhamad dzulfiqar maf mahasiswa cium bibir mahasiswi tutup tuju kait kampus buat mahasiswa pelangaran tindak lanjut permendikbudristek maf iya bicara permendikbud atur lai trmksh wasalamu alaikum
191,asalamualaikum kodil chanel maf mahasiswa cium bibir mahasiswi tutup tuju kait kampus buat mahasiswa pelangaran tindak lanjut permendikbudristek maf iya bicara permendikbud atur lai trmksh wasalamu alaikum
192,muhamad farhan studi iya sebelumya trmksh
193,bingung faham syariat risikoberikhtilath
194,mingu sholat jum at imam khotbah kaya tabayun baca bnr baca main klaim permendikbudristek legal zinah hadeh nyesel jumat
195,mengmangtap kentu
196,pola pikir sempit sex bebas budaya open bo kalang mahasiswi teman ane ayam kampus kampus uin pagi kerudung malam buka warung
197,keras seksual definisi tuju korban logika nolak lawan keras seksual definisi keras seksual
198,dekat zinah atur pasal dl sat demokrasi tdak layak isi penting tingi maslahat masyarakat jadi tameng oknum keras seksual mengunakan media skrang bicara bicara sembarang
199,law is art rinci gampang belok
200,tetap keras seksualitas
201,cocok terap dikemendikbud dpr
202,pakai anak sekolah mahasiswa rok lutut ganti tri bubar
203,korban ragu lapor usul lindung hukum korban polemik pdhal tingal revisi maf diusulkn partai gmn kbrnya
204,presenter suka motong cakap nara sadar
205,ormas islam dukung permedikbudristek keras seksual tolak pasal ayat tuju korban permendikbud nadiem hilang tuju korban
206,negara kacau jabat nyeleneh coba urus subtantif
207,tri nadiem pecat
208,ranah mendikbud iya keras seksual iya ranah menteri perempuan anak
209,permendikbud bnr revisi laksana
210,bicara idiologi sbg muslim fakta terima bicara pojok islam islam islam kotak amal anjur sedekah kbetulan mreka sesat adl saudara muslim mjd isue ksalahan mreka iya ksalahan pnegak hukum adl brsama dhadapi brsama mnertibkan muslim pemahamanya sesat dr sedikit mbahas syurga sbg imbal neraka sbg hukum lbh bahas adl mngenali tuhan konsekuensi mnganut agama brarti mngabdi tuhan mpertahankan imej mngejar syurga
211,aduh atur keras sexual atur penzinahan ini beda tuju korban tuju keras sexual
212,kalimatx difahami tuju korban undang bahasa indonesia bnr kayakx namax korban iya tuju unsur tuju namax oknum korban namax kalimat seharusx revisi hilang kalimat debat kalimat tuju tuju korban bnr
213,degradasi moril
214,zinah haram tuju lawan
215,anehny negeri
216,coba deh tuju permen pasal korban ancam tindak keras seksual tsbt dasar suka suka trus laku ngak kena permen kampus kena pasal tindak a susila trus kena sypa korban laku
217,definisi buat dlm keras seksual definisi iya tuju korban logika wajar kalimat cantum
218,dmitri senang mesum marah permendikbud colek raba raba sangsi buka baju melangar moril kuhp
219,muhamad thohir oke permendikbud bentrok pornografi lai
220,suka suka seks bebas patuh permendikbud membolehkanya
221,dmitri pasal bentrok coba sebut memeng erti ikut ulama kadron
222,dmitri isi otak mesum ulama kadron dalem permendikbud
223,muhamad thohir contoh kuhpnya tubuh suami istri pidana zan pidana penjara denda katagori permendikbud sentuh usap raba pegang peluk cium mengosokan tubuh tubuh korban tuju korban buka pakai korban tuju korban kuhp nyata gamblang ambigu multitafsir sex bebas larang permendikbud dapat seksual tuju korban cium esek malu syah syah implementasi permendikbud bentrok kuhp salah kuhp permendikbudnya ambigu revisi
224,dmitri anak hukum tertawa argumen kutip salahsatu pasal kontroversial pasal ayat keras seksual ayat liput sentuh usap raba pegang peluk cium mengosokan tubuh tubuh korban tuju korban simpul gamblang permendikbud kelompok tindak tindak tuju korban tindak tuju korban tindak tuju korban keras seksual tindak tuju korban ada keras seksual permendikbud samasekali atur tindak tuju korban legal meng ilegal alias iya atur samasekali anak hukum tertawa argumen kutip salahsatu pasal kontroversial pasal ayat keras seksual ayat liput sentuh usap raba pegang peluk cium mengosokan tubuh tubuh korban tuju korban simpul gamblang permendikbud kelompok tindak tindak tuju korban tindak tuju korban tindak tuju korban keras seksual tindak tuju korban ada keras seksual permendikbud samasekali atur konsekwensi tindak tuju korban legal ilegal alias atur samasekali argumentum contrario pikir tindak tuju korban boleh dalem pemendikbud simpul ga dasar
225,dewanga putera oke frase tuju korban frase faham peraturanya timbul polemik multitafsir kontradiksi kuhp a susila lai bentrok nama korban tuju leceh literatur bahasa indonesia korban nama frase tuju korban dampak oknum memanfatkan frase alesanya korban kbi binatang derita mati akibat jadi buat jahat
226,ada korban tuju
227,deh mesti menrisex atur timbul gaduh mknya makul moril agama kasih agama rohani hapus
228,kuad in ok
229,kuad in plis deh agama sekolah kampus leceh seksual
230,gabriela indah charista yes very very very true
231,tuju bang baca peraturanya bacod permendikbud dijelasin tuju korban ayat huruf huruf huruf huruf huruf huruf diangap syah dalem korban alami situasi laku ancam paksa menyalahgunakan kedudukanya
232,tuju laku laku ancam
233,baca iya paham konsep consent ga tuju ga tuju mulut baca bicara
234,dewan permen jk moral bejad buk jk keluarga tanam moril agama rasa kendali agama apa larang zan jk perkosan mk laku lapor polisi ibuk dewan jk alesanya suka suka
235,vissi miss presiden tri jabar dlm bijak revolusi mental jokowi
236,tuju korban ganti hapus
237,sempat goreng gosong jokowi jatuh
238,segalasesuatu serah ahli tungu kehancuranya
239,host las ganti bicara
240,sentuh haram ikut hukum islam alah swt atur atur hdp
241,logika rakyat indonesia larang bawa senjata tajam bawa senjata api
242,enak bgt suka suka ga main kampus
243,pks engkau harap rakyat indonesia
244,suka suka wilayah private perkara moril individu didik mora
245,terap atur zinah perkosan entar atur terap olah izin perempuanya inget negara panca sila sila tuhan maha esa perempuanya tuju ga tuju syah pasang iya mesti larang tri agama ngedukung negara negara panca sila sila mna terap
246,atur laksana atur tat atur tat syariat
247,harus tungu korban simak penyelesaianya adil bnr
248,polemik timbul gaduh onar
249,pks cman gaduh alih isu godbener jekartah angota par tainya masalah formula usut kpk
