,Komentar
498,akhsan andi bang pasal zan ikat prostitusi lap lindung anak korbanya mas bawah umur nasional single propinsi kota hukumanya denda penjara iya nanangin tindak a susila zinah nangin keras seksual korban dalem paksan mikir legalin zinah konteks beda zinah gabisa single agama larang tau ngelarang zinah atur agama islam maksud ketentuanya islam gatau agama ngelarang beda konsep
499,akhsan andi iya nasional atur propinsi kota ambil contoh tangsel kota ga salah kena denda juta tahu a susila kamar penjara ulang surat perjanjianya
500,iya gantung daerah atur tindak a susila gak daerah atur daerah mayoritas muslim tahu iya ralat salah permendikbud islamis tuju keras seksual buat benar maksud permendikbud celah permendikbud manfatkan maf maf ayam kampus legal standing
501,udahlah gak debatin gak ngubah posisi belah lihat twiter uji materi permendikbud ma iya lihat depa
502,akai ondom elalu
503,ngak tindak pemendikbud tindak kuhp pasal
504,sus tri andarwati mekanisme hukum payung hukum gk jerat laku tindak a susila
505,julidz sebut kuhp pasal
506,sus tri andarwati itu rancang bu syah suruh teman teman sekulib protes kuhp cpt syah muncul atur atur permendikbud gak muncul polemik kaum sekulib kaum islamis
507,akhsan andi teman
508,sus tri andarwati gak teman teman sekulib oke bu rkuhp jalan tekan
509,akhsan andi sekulib kuhp aju perintah perintah lindung negara buat zinah mendikbud dukung perintah nama bantu presiden ga klausal mendikbud legal zinah
510,sus tri andarwati nama rkuhp sahkan gak ikat komentar olah rkuhp pasal jerat laku perzinahan ikat kawin single
511,akhsan andi iya rubah kenyat perintah aju usaha selesai kuhpnya perintah usaha melundungi negara buat zinah trus hubunganya permendikbud dilegalkanya zinah permendikbud zinah larang larang zinah sat syah permendikbud
512,sus tri andarwati ikat salah laku ikat kawin delik adu proses pasang syah salah laku ngadu
513,sus tri andarwati iya perintah mangkrak alias sahkan payung hukum tindak laku perzinahan luas permendikbud bnr gak zinah sex bebas protes kaum islamis frase tuju
514,sus tri andarwati permendikbud revisi iya kaum islamis legowo permendikbud
515,akhsan andi halah ga solusiable spk agamais diem leceh pesantren didik keluarga kena nikahin laku leceh keluarga korban maklum pikir tertingal bobrok
516,raja bla bla bla mucho texto nikmatin seteru wkwkwkwk
517,akhsan andi menrisex permen laku dunia didik
518,ente bicara ente pernyatan
519,akhsan andi frase tuju tuju leceh
520,aduh males bahas komen bales
521,hehehe penting tuju tuju
522,prbuatan zinah deh aturany sndri kuhp hukum agama msing komen kyak bocah paud deh gede blon
523,wongemblung neng ye udeh bebas main kampus hemat saudara laki laki ga hotel lindung negara bwahahahah
524,rush day iya gni toge dksih otak main hp goblokny natural
525,juli yaelah cuan tukang ecer kond kampus gas stock banyakin ahahaha
526,rush day trnyta drone kelas paud ngoceh
527,setujuj pakek pakean pantai jos brow
528,juli kadrun cerdas megunakan akal sehat gak permen nyuri sempat permen berani manusia moral berahlaq tat agama gak ayo ikut perintah agama tingalkan larang agama brow
529,atur alah dilangar laku keras seksual keras seksual atur manusia
530,senjata beda mas senjata berantas kuhp bahas tindak a susila
531,nila titik rusak susu belanga pasal revisi liberal halal penzinahan
532,nadiem kurikulum kanya tambah ajar sex bebas rayu lacur hukum negara mjd korban atur atur
533,rasuk
534,simak
535,revisi gus dur repot
536,muhamadiyah ikadi mui prof cholis naf tolak suruh pergi permendikbudristek th nu suara iya wakil prof cholil naf
537,pks poligami turun
538,negara truskan anak hasil zinah bagus dimcok
539,kalang guru tingi gak nolak zina atur tri
540,cecep bicara
541,klu selangkang pks cpt tangap
542,pks kritik permen bnr lanjut mas tri
543,inget angota pks nonton porno sidang bwahaha pks bela keras rem mpret urusin kader mu kampanye poligami ngak perempuan terima poligami diskusi cari sensasi jalan unya cpt tindakanya jalan amat revisi kakehan ngoceh
544,legal zinah jepang
545,aborsi efek hamil luar nikah
546,atur bnr keras seksual lawan dibrantas
547,tanda jaman naudzubilah
548,inalilahi wa inalilahi roji un
549,moga oengagas anak istri korban plaku zinah sek bas amin
550,mas mah beda beda senjata keras seksual lingkung kampus tembak pake permendikbudristek bicara tindak seksual tuju belah kampus tindak a susila pakek atur atur kampus atur larang tindak a susila kampus kode etik dosen laku dosen kuhp senjata sesuai permendikbudristek gk tindak laku a susila ranah mekanisme hukum patokanya nangkepnya bincang bahas luar konteks
551,korban ancam bicara dasar suka suka trus penjara korban
552,usul
553,pks revisi nungu korban tambah selese
554,rifki fauzi iya kelam gilir ngusulin kritisi
555,bnr
556,saudara laki laki urus ginian pks ga nyampe nalar tertawa oposisi payah lelet
557,tuju
558,indonesia maju kaya jepang ga islamabad belakang
559,riza kun kena azab
560,xmbelgedesh mitos gaung kelompok pondasi khayal bnr teori bukti banding negara negara
561,riza kun paham panca sila buka blue silah pimpin kawan dahulu materi drpd pondasi
562,xmbelgedesh ga faham panca sila kadrun iya make argumen tuhan atur hukum agama hukum praktis idiologi hukum syariat kaya arab panca sila kaya indonesia iya mengunakan panca sila bank konvensional ilegal qur riba haram injil ursury haram tetep ga ilegal idiologi demokrasi agama dosa urus urus negara meng ilegalkanya negara demokrasi syariat panca sila demokrasi syariat moga erti iya drun
563,pasal sebab aborsi permendikbud cegah tangan keras seksual giring legal zinah
564,zinah legal tanda kiamat
565,nti haml dluar nikah buru nikah siri ikut celeng benar bel pkoknya ikut fatwa partai lurus wakl ketua mui los krna mreka mrasa kuat bkuasa silah apadaya rakyt sbg rakyt hak bdoa bnar smoga anak cucu isteri mreka laku korban sek bas hamil brulang dluar nikah ga jlas mnghamili isteri mreka ga malu mlakukan sek bas dpan mreka skalipun nti patuh
566,dewi sriyati ngedongeng bu kyknya gk faham bahas tau teriak dukung teriakin gak faham substansi bicara ckckck
567,dewi sriyati kasi kalah debat serang personal paham makan berita goreng
568,gak aborsi larang rekomendasi dokter
569,logika liar ga sex bebas iya ga moril nyalahin permen
570,dukung sepenuh syarat frase tuju korban hapus permendikbud bentrok atur undang a susila nama korban korban tuju laku keras seksual suka suka sex bebas legal permendikbud kontra a susila lai situ permasalahanya
571,keras lembut syah cegah inget sila tuhan maha esa atur agama utama
572,dian chanel agama saudara laki laki
573,buka wafat nabi muhamad kategori jaman nabi wafat hinga depan msk jaman
574,lho memang dukung laku keras seksual nyata salah
575,kalimat tunjuk zinah legal permendikbud bu
576,amin
577,nyumpahin gin ngucap
578,muhamad dzulfiqar ok mengangap permendikbudristek gak legal zinah permendikbud ditandatangani mendikbudristek maf anda mahasiswa cium mahasiswi tutup kampus mahasiswi tuju buat tahu lai buat dalem pelangaran tindak lanjut permendikbudristek
579,muhamad farhan atur cegah tangan keras seksual atur tindak a susila kampus beda tuju korban hukum tindak a susila larang tuju hapus korban tindak keras seksual hukum diamenyetujui tindak lindung korban hukum tindak a susila larang korban keras seksual libat dalem tindak a susila tuju buat korban pemaksan hukum laku keras seksual
580,asalamualaikum muhamad dzulfiqar iya permendikbudristek permen tangan cegah seksual maf iya permendikbud frase tuju korban dalem pasal mahasiswa cium bibir mahasiswi pacar mengosokan kelam mahasiswi pacar tutup kampus mahasiswi pacar tuju buat tahu pelangaran gak ditindaklanjuti mahasiswi pacar tuju permendikbudristek beda mahasiswi pacar gak tuju pelangaran tindak lanjut permendikbudristek maf jahat keras seksual akibat buat tindak seksual tentang nilai norma nilai norma agama akar keras jahat seksual trmksh wasalamu alaikum
581,muhamad farhan permnedikbudristek ulang fokus tangan cegah keras seksual latar banyak keras seksual selesai adil korban keras seksual kampus penyelesaina lindung korban permendikbudristek selesai keras seksual kampus studi tindak keras seksual tindak a susila bicara keras korban korban rugi laku sebab rugi tuju tindak korban laku tindak a susila kampus kode etik kampus kait tindak a susila kuhp lindung anak cerita permendikbudristek tuju atur tindak a susila lingkung kampus beda letak legal zinah atur
582,asalamualaikum muhamad dzulfiqar maf kuhp zinah syah maf saudara anda mahasiswa cium bibir mahasiswi pacar mengosokan kelam tubuh mahasiswi pacar tutup kampus mahasiswi pacar tuju tahu lai buat mahasiswa pelangaran tindak lanjut permendikbudristek maf saudara kuhp perzinahan syah
583,muhamad farhan permendikbudristek atur tangan cegah keras seksual kampus atur tindak a susila kampus lahir latar atas studi pandang atas atur tindak a susila indonesia permendikbudristek legal zinah
584,asalamualaikum muhamad dzulfiqar maf mahasiswa cium bibir mahasiswi tutup tuju kait kampus buat mahasiswa pelangaran tindak lanjut permendikbudristek maf iya bicara permendikbud atur lai trmksh wasalamu alaikum
585,asalamualaikum kodil chanel maf mahasiswa cium bibir mahasiswi tutup tuju kait kampus buat mahasiswa pelangaran tindak lanjut permendikbudristek maf iya bicara permendikbud atur lai trmksh wasalamu alaikum
586,muhamad farhan studi iya sebelumya trmksh
587,bingung faham syariat risikoberikhtilath
588,mingu sholat jum at imam khotbah kaya tabayun baca bnr baca main klaim permendikbudristek legal zinah hadeh nyesel jumat
589,mengmangtap kentu
590,pola pikir sempit sex bebas budaya open bo kalang mahasiswi teman ane ayam kampus kampus uin pagi kerudung malam buka warung
591,aldo binar udah clear saudara laki laki dosenya udah depak sm kampus bukti cakap tsb
592,udah baca hilang tuju kategori leceh seksual kontak pisik tuju laku tawar transaksi sex ditawarin dosen nilai photo telanjang verbal udah alat lapor transaksi tuju lihat make photo ginian mampu paham udah atas
593,aluxes permen dosen nawarin sex aman iya saudara laki laki gak dijadin alat bukti
594,awi asnawi gak kontak pisik teman korban laporin dasar dalem permendikbud cat caling diangap leceh
595,aluxes literasi edukasi serang
596,aufa bilah literasi tipe org mikirnya ngeres melulu saudara laki laki susah proses positiv informasi kait seksual
597,aluxes iya bnr kait profesional zinah pasal beban buat a susila berfikirnya
598,leceh verbal udah pasal kuhp kuhp udah leceh verbal sentuh interface
599,dapat zinah sadar suka suka tekan keras perzinahan perbutan butuh tekan keras
600,judul oke isi legal keras baca isi teliti tri
601,tujuanya mas tri frase dalem permendikbud tuju tuju boleh
602,bicara nadiem salah ngeyel
603,asatgfiruloh
604,munkin makarim sukak sex
605,dajal
606,keras sex wanita apa alesanya bukti disetubuhin perempuan laki laki hukum perempuan ngasi brng laki laki jaga jakar guru polisi keras sex pecat hukum umur
607,tokoh wanita diem
608,ngenyel bgt kadrun permendikbud tujuanya lindung korban keras seksual lingkung guru tingi dalem permendikbud arah zinah hadeh hadeh negara sayang ribet bicara atur zinah sono usul dpr peraturanya sangkut paut lingkup konteks permendikbud
609,dingin pisah kelas laki laki kelas perempuan gerbong kereta
610,mahasiswa tolak tungangi ulama kadron otak mesum paham salah permendikbud legal sek bebas lgbt
611,perintah presiden jokowi tangung didik
612,semangat harga mslhx adh norma tulis frase tuju bukti legalx sex tuju
613,tubuh bungkus permen lolipop gak giur bungkus bentuk iya tutup bungkus faham mahaciwi
614,ojk ga berani tutup pinjol legal pdhl praktek bunga pinjol legal tinghi bngt ojk nga rugi pinjol nga bngt mikirin pinjol bahasa lampau guwe pikirin
615,riil bgt keras seksual kampus darurat oknum tuju permendikbud alesanya konotasi halal zinah tragis negri
616,disamain he tuju instal smartphone hihihi
617,permendikbudristek terap klu pemaksan keras alias pemerkosan ngak benar kecuali suka senang terap permenya terap kaedah kaedah hukum norma norma sopan alias tonton
618,ngeyel
619,hadeh lgbt gak kelas pesantren lgbt diem diem
620,bukti merasakanya teman pesantren belok lawan narapidana seprti
621,efek tri comot gak gak pandai indonesia
622,tri musyawarah ma mui nu muhamdiah deal comot
623,hancur iman hancur ahklak norma tekan kait ga becus ngajar ngedidik murid melangar pecat kasi sen bnr murid bnr oknum babad musnah
624,enak suka suka bebas gak pidana kaya kucing kawin mna
625,otak mesum serap frase tuju tuju dalih sex bebas tameng kadrun otak mesum kontroversi negativ otak iya iya konteks leceh keras sex isi atur bnr lari zinah wani piro undang prostitusi
626,kadrun doyan cabul gak terima gak mesum gara atur
627,dalem adan darurat sedih didik didik
628,usul tri klu maha siswa uji smester klu uang dmester klu blhkan tap mask uji bayar maha siswa indonesia swasta negri situasi kopit pulih ekonomi org tua susah cari mkn cm usul mksh tri bayar stengah seluru pilih klu uang klu blhlkan smseter uji maha siswa mksih presiden
629,lancar bisnis hotel
630,deh hormat mundur
631,atur dalem konteks keras seksual zinah beda konteks beda peraturanya mhn simak komentar keras istilah tuju atur matang
632,atur leceh sexual nakarim bikin celah sex bebas akal hasil survey korbanya rugi
633,oke nadiem atur gak dosen cabul berani megang tangan pundak mahasiswi ijin ga dosen genit mangil mahasiswi syg love you ijin mahasiswi ijin dosen cabul dalih pegang tangan gurau foto ga pidana permen dosen cabul gemeteran waswas aksi salah ijin mahasiswi dosen cabul kena pidana leceh seksual
634,permendikbudristekdikti pasal boleh zinah revisi pasal tentang panca sila sila tuhan maha esa tuju lawan syar at
635,udah ganti menteri sekolah didik amburadul jaman skrg
636,hukum mati selese
637,laki laki perempuan
638,germo
639,gawat darurat kampus karenahukum jalan nadim makarim silah mundur diangap ingat kampus manusia manusia ternak lacur
