,Komentar,Label,TOKENIZATION,STOP_REMOVAL,STEMMER,Komentar_Final
0,lha kekerasan seksual itu kan mmg definisinya memang harus tanpa persetujuan korban pada kemana sih logika yg nolak gimana melawan kekerasan seksual kalau tidak boleh didefinisikan apa yg dimaksud dgn kekerasan seksual ,positif,"['lha', 'kekerasan', 'seksual', 'itu', 'kan', 'mmg', 'definisinya', 'memang', 'hrs', 'tanpa', 'persetujuan', 'korban', 'pada', 'kemana', 'sih', 'logika', 'yg', 'nolak', 'gimana', 'melawan', 'kekerasan', 'seksual', 'klw', 'ndak', 'boleh', 'didefinisikan', 'aoa', 'yg', 'dimaksud', 'dgn', 'kekerasan', 'seksual']","['lha', 'kekerasan', 'seksual', 'mmg', 'definisinya', 'hrs', 'persetujuan', 'korban', 'kemana', 'logika', 'nolak', 'gimana', 'melawan', 'kekerasan', 'seksual', 'klw', 'ndak', 'didefinisikan', 'aoa', 'kekerasan', 'seksual']","['lha', 'keras', 'seksual', 'mmg', 'definisi', 'hrs', 'tuju', 'korban', 'mana', 'logika', 'nolak', 'gimana', 'lawan', 'keras', 'seksual', 'klw', 'ndak', 'definisi', 'aoa', 'keras', 'seksual']",lha keras seksual mmg definisi hrs tuju korban mana logika nolak gimana lawan keras seksual klw ndak definisi aoa keras seksual
1,jangan mendekati zina itu adalah aturan yang pasti dan tidak perlu pasal uu dll suatu saat demokrasi ini tdak layak lagi untuk di gunakan karena isi nya hanya kepentingan para petinggi saja sangat sedikit untuk kemaslahatan masyarakatnya dan saya rasa ini bisa di jadikan tameng oleh para oknum bahwa melakukan kekerasan seksual jangan menggunakan media skrang saja banyak yang ngomong ngawur ,negatif,"['jngan', 'mendekati', 'zinah', 'itu', 'adalah', 'aturan', 'yg', 'pasti', 'dn', 'ndak', 'perlu', 'pasal', 'uu', 'dll', 'suatu', 'saat', 'demokrasi', 'ini', 'tdak', 'layak', 'gy', 'untk', 'di', 'gunakan', 'krn', 'isi', 'nya', 'cuma', 'kepentingan', 'para', 'petinggi', 'saja', 'amat', 'sedikit', 'untk', 'kemaslahatan', 'masyarakatnya', 'dn', 'aq', 'rasa', 'ini', 'bsa', 'di', 'jadikan', 'tameng', 'oleh', 'para', 'oknum', 'bahwa', 'melakukan', 'kekerasan', 'seksual', 'jngan', 'menggunakan', 'media', 'skrang', 'saja', 'byk', 'yg', 'ngomong', 'ngawur']","['jngan', 'mendekati', 'zinah', 'aturan', 'dn', 'ndak', 'pasal', 'uu', 'dll', 'demokrasi', 'tdak', 'layak', 'untk', 'isi', 'kepentingan', 'petinggi', 'untk', 'kemaslahatan', 'masyarakatnya', 'dn', 'aq', 'bsa', 'jadikan', 'tameng', 'oknum', 'kekerasan', 'seksual', 'jngan', 'media', 'skrang', 'byk', 'ngomong', 'ngawur']","['jngan', 'dekat', 'zinah', 'atur', 'dn', 'ndak', 'pasal', 'uu', 'dll', 'demokrasi', 'tdak', 'layak', 'untk', 'isi', 'penting', 'petinggi', 'untk', 'maslahat', 'masyarakat', 'dn', 'aq', 'bsa', 'jadi', 'tameng', 'oknum', 'keras', 'seksual', 'jngan', 'media', 'skrang', 'byk', 'ngomong', 'ngawur']",jngan dekat zinah atur dn ndak pasal uu dll demokrasi tdak layak untk isi penting petinggi untk maslahat masyarakat dn aq bsa jadi tameng oknum keras seksual jngan media skrang byk ngomong ngawur
2,the law is an art semakin rinci semakin mudah dibelokkan ,netral,"['the', 'law', 'is', 'an', 'art', 'semakin', 'rinci', 'semakin', 'gampang', 'dibelokkan']","['the', 'law', 'is', 'art', 'rinci', 'gampang', 'dibelokkan']","['the', 'law', 'is', 'art', 'rinci', 'gampang', 'belok']",the law is art rinci gampang belok
3,tetapkan dulu apa yang dimaksud dengan kekerasan seksualitas ,netral,"['tetapkan', 'dulu', 'aoa', 'yg', 'dimaksud', 'dgn', 'kekerasan', 'seksualitas']","['tetapkan', 'aoa', 'kekerasan', 'seksualitas']","['tetap', 'aoa', 'keras', 'seksualitas']",tetap aoa keras seksualitas
4,lbih cock diterapkan dikemendikbud dan dpr ,netral,"['lbih', 'cock', 'diterapkan', 'dikemendikbud', 'dn', 'dpr']","['lbih', 'cock', 'diterapkan', 'dikemendikbud', 'dn', 'dpr']","['lbih', 'cock', 'terap', 'dikemendikbud', 'dn', 'dpr']",lbih cock terap dikemendikbud dn dpr
5,sekalian aja pakaian anak sekolah dan mahasiswa rok nya harus di atas lutut atau ganti aja menteri nya mungkin yg ingin membubarkan dia ikut juga,negatif,"['sekalian', 'aja', 'pakaian', 'anak', 'sekolah', 'dn', 'mahasiswa', 'rok', 'nya', 'hrs', 'di', 'atas', 'lutut', 'atau', 'ganti', 'aja', 'mentri', 'nya', 'mungkin', 'yg', 'ingin', 'membubarkan', 'dia', 'ikut', 'jga']","['pakaian', 'anak', 'sekolah', 'dn', 'mahasiswa', 'rok', 'hrs', 'lutut', 'ganti', 'mentri', 'membubarkan', 'jga']","['pakai', 'anak', 'sekolah', 'dn', 'mahasiswa', 'rok', 'hrs', 'lutut', 'ganti', 'tri', 'bubar', 'jga']",pakai anak sekolah dn mahasiswa rok hrs lutut ganti tri bubar jga
6,inilah makanya para korban ragu utk melapor usulan uu perlindungan hukum utk para korban pun jd polemik pdhal tinggal direvisi maaf uu yg katanya waktu itu akan diusulkn oleh suatu partai itu gmn kbrnya ,netral,"['inilah', 'makanya', 'para', 'korban', 'ragu', 'utk', 'melapor', 'usulan', 'uu', 'perlindungan', 'hukum', 'utk', 'para', 'korban', 'pun', 'jd', 'polemik', 'pdhal', 'tinggal', 'direvisi', 'apologize', 'uu', 'yg', 'katanya', 'waktu', 'itu', 'akan', 'diusulkn', 'oleh', 'suatu', 'partai', 'itu', 'gmn', 'kbrnya']","['korban', 'ragu', 'melapor', 'usulan', 'uu', 'perlindungan', 'hukum', 'korban', 'jd', 'polemik', 'pdhal', 'tinggal', 'direvisi', 'apologize', 'uu', 'diusulkn', 'partai', 'gmn', 'kbrnya']","['korban', 'ragu', 'lapor', 'usul', 'uu', 'lindung', 'hukum', 'korban', 'jd', 'polemik', 'pdhal', 'tinggal', 'revisi', 'apologize', 'uu', 'diusulkn', 'partai', 'gmn', 'kbrnya']",korban ragu lapor usul uu lindung hukum korban jd polemik pdhal tinggal revisi apologize uu diusulkn partai gmn kbrnya
7,presenter suka motong percakapan narasumber jd kurang ngeh gitu,netral,"['presenter', 'suka', 'motong', 'percakapan', 'nara', 'jd', 'kurang', 'ngeh', 'gitu']","['presenter', 'suka', 'motong', 'percakapan', 'nara', 'jd', 'ngeh', 'gitu']","['presenter', 'suka', 'motong', 'cakap', 'nara', 'jd', 'ngeh', 'gitu']",presenter suka motong cakap nara jd ngeh gitu
8,kami sebagai ormas islam mendukung permedikbudristek no  tentang kekerasan seksual tapi kami menolak pasal  ayat  yg ada kata tanpa persetujuan korban dan seharusnya permendikbud nadiem menghilangkan yg  kata tanpa persetujuan korban,positif,"['kami', 'sebagai', 'ormas', 'islam', 'mendukung', 'permedikbudristek', 'no', 'tentang', 'kekerasan', 'seksual', 'tapi', 'kami', 'menolak', 'pasal', 'ayat', 'yg', 'ada', 'kata', 'tanpa', 'persetujuan', 'korban', 'dn', 'seharusnya', 'permendikbud', 'nadiem', 'menghilangkan', 'yg', 'kata', 'tanpa', 'persetujuan', 'korban']","['ormas', 'islam', 'mendukung', 'permedikbudristek', 'no', 'kekerasan', 'seksual', 'menolak', 'pasal', 'ayat', 'persetujuan', 'korban', 'dn', 'permendikbud', 'nadiem', 'menghilangkan', 'persetujuan', 'korban']","['ormas', 'islam', 'dukung', 'permedikbudristek', 'no', 'keras', 'seksual', 'tolak', 'pasal', 'ayat', 'tuju', 'korban', 'dn', 'permendikbud', 'nadiem', 'hilang', 'tuju', 'korban']",ormas islam dukung permedikbudristek no keras seksual tolak pasal ayat tuju korban dn permendikbud nadiem hilang tuju korban
9,negara kacau pejabatnya nyeleneh coba urus yg subtantif,negatif,"['negara', 'kacau', 'pejabatnya', 'nyeleneh', 'coba', 'urus', 'yg', 'subtantif']","['negara', 'kacau', 'pejabatnya', 'nyeleneh', 'coba', 'urus', 'subtantif']","['negara', 'kacau', 'jabat', 'nyeleneh', 'coba', 'urus', 'subtantif']",negara kacau jabat nyeleneh coba urus subtantif
10,menteri nadiem segera dipecat,negatif,"['mentri', 'nadiem', 'segera', 'dipecat']","['mentri', 'nadiem', 'dipecat']","['tri', 'nadiem', 'pecat']",tri nadiem pecat
11,ranah mendikbud ya kekerasan seksual kalau yg lain ya ranah kementerian perempuan dan anak,positif,"['ranah', 'mendikbud', 'ya', 'kekerasan', 'seksual', 'klw', 'yg', 'lain', 'ya', 'ranah', 'kementerian', 'perempuan', 'dn', 'anak']","['ranah', 'mendikbud', 'kekerasan', 'seksual', 'klw', 'ranah', 'kementerian', 'perempuan', 'dn', 'anak']","['ranah', 'mendikbud', 'keras', 'seksual', 'klw', 'ranah', 'menteri', 'perempuan', 'dn', 'anak']",ranah mendikbud keras seksual klw ranah menteri perempuan dn anak
12,permendikbud sudah benar jangan di revisi lanjut laksanakan,positif,"['permendikbud', 'sdh', 'bnr', 'jngan', 'di', 'revisi', 'lanjut', 'laksanakan']","['permendikbud', 'bnr', 'jngan', 'revisi', 'laksanakan']","['permendikbud', 'bnr', 'jngan', 'revisi', 'laksana']",permendikbud bnr jngan revisi laksana
13,berbicara ideologi boleh saja sbg muslim tp fakta ttp hrus diterima kalau bicara ini seolah memojokkan islam islam yg mana apakah hanya islam yg punya kotak amal dan menganjurkan bersedekah kbetulan saja mreka yg sesat adl saudara qt sesama muslim jika mjd isue besar krn ksalahan mreka ya bkn ksalahan pnegak hukum itu adl masalah brsama yg hrus dhadapi brsama bgmn caranya qt mnertibkan muslim dg pemahamanya agar tdk sesat mulailah dr menyedikitkan mmbahas surga sbg imbalan dan neraka sbg hukuman krn yg lbh harus dibahas adl cara mngenali tuhan dan konsekuensinya serta mnganut agama brarti mngabdi pd tuhan bkn mmpertahankan imej atau mngejar surga ,netral,"['berbicara', 'idiologi', 'boleh', 'saja', 'sbg', 'muslim', 'tp', 'fakta', 'ttp', 'hrus', 'diterima', 'klw', 'bicara', 'ini', 'seolah', 'memojokkan', 'islam', 'islam', 'yg', 'mana', 'apakah', 'cuma', 'islam', 'yg', 'punya', 'kotak', 'amal', 'dn', 'menganjurkan', 'bersedekah', 'kbetulan', 'saja', 'mreka', 'yg', 'sesat', 'adl', 'saudara', 'qt', 'sesama', 'muslim', 'jika', 'mjd', 'isue', 'besar', 'krn', 'ksalahan', 'mreka', 'ya', 'bkn', 'ksalahan', 'pnegak', 'hukum', 'itu', 'adl', 'masalh', 'brsama', 'yg', 'hrus', 'dhadapi', 'brsama', 'bgmn', 'caranya', 'qt', 'mnertibkan', 'muslim', 'dg', 'pemahamanya', 'agar', 'tdk', 'sesat', 'mulailah', 'dr', 'menyedikitkan', 'mmbahas', 'syurga', 'sbg', 'imbalan', 'dn', 'neraka', 'sbg', 'hukuman', 'krn', 'yg', 'lbh', 'hrs', 'dibahas', 'adl', 'cara', 'mngenali', 'tuhan', 'dn', 'konsekuensinya', 'serta', 'mnganut', 'agama', 'brarti', 'mngabdi', 'pd', 'tuhan', 'bkn', 'mmpertahankan', 'imej', 'atau', 'mngejar', 'syurga']","['berbicara', 'idiologi', 'sbg', 'muslim', 'tp', 'fakta', 'ttp', 'hrus', 'diterima', 'klw', 'bicara', 'memojokkan', 'islam', 'islam', 'islam', 'kotak', 'amal', 'dn', 'menganjurkan', 'bersedekah', 'kbetulan', 'mreka', 'sesat', 'adl', 'saudara', 'qt', 'muslim', 'mjd', 'isue', 'ksalahan', 'mreka', 'bkn', 'ksalahan', 'pnegak', 'hukum', 'adl', 'masalh', 'brsama', 'hrus', 'dhadapi', 'brsama', 'bgmn', 'qt', 'mnertibkan', 'muslim', 'pemahamanya', 'tdk', 'sesat', 'dr', 'menyedikitkan', 'mmbahas', 'syurga', 'sbg', 'imbalan', 'dn', 'neraka', 'sbg', 'hukuman', 'lbh', 'hrs', 'dibahas', 'adl', 'mngenali', 'tuhan', 'dn', 'konsekuensinya', 'mnganut', 'agama', 'brarti', 'mngabdi', 'pd', 'tuhan', 'bkn', 'mmpertahankan', 'imej', 'mngejar', 'syurga']","['bicara', 'idiologi', 'sbg', 'muslim', 'tp', 'fakta', 'ttp', 'hrus', 'terima', 'klw', 'bicara', 'pojok', 'islam', 'islam', 'islam', 'kotak', 'amal', 'dn', 'anjur', 'sedekah', 'kbetulan', 'mreka', 'sesat', 'adl', 'saudara', 'qt', 'muslim', 'mjd', 'isue', 'ksalahan', 'mreka', 'bkn', 'ksalahan', 'pnegak', 'hukum', 'adl', 'masalh', 'brsama', 'hrus', 'dhadapi', 'brsama', 'bgmn', 'qt', 'mnertibkan', 'muslim', 'pemahamanya', 'tdk', 'sesat', 'dr', 'sedikit', 'mmbahas', 'syurga', 'sbg', 'imbal', 'dn', 'neraka', 'sbg', 'hukum', 'lbh', 'hrs', 'bahas', 'adl', 'mngenali', 'tuhan', 'dn', 'konsekuensi', 'mnganut', 'agama', 'brarti', 'mngabdi', 'pd', 'tuhan', 'bkn', 'mmpertahankan', 'imej', 'mngejar', 'syurga']",bicara idiologi sbg muslim tp fakta ttp hrus terima klw bicara pojok islam islam islam kotak amal dn anjur sedekah kbetulan mreka sesat adl saudara qt muslim mjd isue ksalahan mreka bkn ksalahan pnegak hukum adl masalh brsama hrus dhadapi brsama bgmn qt mnertibkan muslim pemahamanya tdk sesat dr sedikit mmbahas syurga sbg imbal dn neraka sbg hukum lbh hrs bahas adl mngenali tuhan dn konsekuensi mnganut agama brarti mngabdi pd tuhan bkn mmpertahankan imej mngejar syurga
14,duh ini peraturan kekerasan sexual bukan peraturan penzinahan inikan  hal yg berbeda makanya ada kata tanpa persetujuan korban kl ada persetujuan yah bukan kekerasan sexual ,positif,"['duh', 'ini', 'peraturan', 'kekerasan', 'sexual', 'bukan', 'peraturan', 'penzinahan', 'inikan', 'hal', 'yg', 'berbeda', 'makanya', 'ada', 'kata', 'tanpa', 'persetujuan', 'korban', 'kl', 'ada', 'persetujuan', 'yah', 'bukan', 'kekerasan', 'sexual']","['duh', 'peraturan', 'kekerasan', 'sexual', 'peraturan', 'penzinahan', 'inikan', 'berbeda', 'persetujuan', 'korban', 'kl', 'persetujuan', 'kekerasan', 'sexual']","['duh', 'atur', 'keras', 'sexual', 'atur', 'penzinahan', 'ini', 'beda', 'tuju', 'korban', 'kl', 'tuju', 'keras', 'sexual']",duh atur keras sexual atur penzinahan ini beda tuju korban kl tuju keras sexual
15,kalimatx saja sdh bisa difahami tanpa persetujuan korban ini yg bikin undang blm bisa bahasa indonesia yg baik dan benar kayakx namax aja korban ya jls pastilah dia tidak setuju kalau ada unsur persetujuan itu namax oknum bukan korban lagi namax jdi kalimat nya seharusx direvisi baik itu ditambahkan atau dihilangkan sama sekali kalimat itu kalau mau tidak jdi perdebatan tambah lagi dengan kalimat baik dapat persetujuan ataupun tidak atas persetujuan korban itu baru benar,negatif,"['kalimatx', 'saja', 'sdh', 'bsa', 'difahami', 'tanpa', 'persetujuan', 'korban', 'ini', 'yg', 'bikin', 'undang', 'blm', 'bsa', 'bahasa', 'indonesia', 'yg', 'bae', 'dn', 'bnr', 'kayakx', 'namax', 'aja', 'korban', 'ya', 'jls', 'pastilah', 'dia', 'ndak', 'setuju', 'klw', 'ada', 'unsur', 'persetujuan', 'itu', 'namax', 'oknum', 'bukan', 'korban', 'gy', 'namax', 'jdi', 'kalimat', 'nya', 'seharusx', 'direvisi', 'bae', 'itu', 'ditambahkan', 'atau', 'dihilangkan', 'sama', 'sekali', 'kalimat', 'itu', 'klw', 'mau', 'ndak', 'jdi', 'perdebatan', 'tambah', 'gy', 'dgn', 'kalimat', 'bae', 'dpt', 'persetujuan', 'atau pun', 'ndak', 'atas', 'persetujuan', 'korban', 'itu', 'baru', 'bnr']","['kalimatx', 'bsa', 'difahami', 'persetujuan', 'korban', 'undang', 'blm', 'bsa', 'bahasa', 'indonesia', 'bae', 'dn', 'bnr', 'kayakx', 'namax', 'korban', 'jls', 'ndak', 'setuju', 'klw', 'unsur', 'persetujuan', 'namax', 'oknum', 'korban', 'namax', 'jdi', 'kalimat', 'seharusx', 'direvisi', 'bae', 'dihilangkan', 'kalimat', 'klw', 'ndak', 'jdi', 'perdebatan', 'kalimat', 'bae', 'dpt', 'persetujuan', 'atau pun', 'ndak', 'persetujuan', 'korban', 'bnr']","['kalimatx', 'bsa', 'difahami', 'tuju', 'korban', 'undang', 'blm', 'bsa', 'bahasa', 'indonesia', 'bae', 'dn', 'bnr', 'kayakx', 'namax', 'korban', 'jls', 'ndak', 'tuju', 'klw', 'unsur', 'tuju', 'namax', 'oknum', 'korban', 'namax', 'jdi', 'kalimat', 'seharusx', 'revisi', 'bae', 'hilang', 'kalimat', 'klw', 'ndak', 'jdi', 'debat', 'kalimat', 'bae', 'dpt', 'tuju', 'atau pun', 'ndak', 'tuju', 'korban', 'bnr']",kalimatx bsa difahami tuju korban undang blm bsa bahasa indonesia bae dn bnr kayakx namax korban jls ndak tuju klw unsur tuju namax oknum korban namax jdi kalimat seharusx revisi bae hilang kalimat klw ndak jdi debat kalimat bae dpt tuju atau pun ndak tuju korban bnr
16,itu sama dg zinah haram kcuali ada setuju lawan,netral,"['itu', 'sama', 'dg', 'zinah', 'haram', 'kcuali', 'ada', 'setuju', 'lawan']","['zinah', 'haram', 'kcuali', 'setuju', 'lawan']","['zinah', 'haram', 'kcuali', 'tuju', 'lawan']",zinah haram kcuali tuju lawan
17,makin aneh saja negeriku sekarang ini,netral,"['makin', 'anehny', 'saja', 'negeriku', 'sekarang', 'ini']","['anehny', 'negeriku']","['anehny', 'negeri']",anehny negeri
18,coba deh buat yg setuju sama permen pasal  ini kalo si korban di ancam untuk bilang kalo tindakan kekerasan seksual tsbt atas dasar suka sama suka trus pelaku nggak kenai permen di kampus kenanya pasal tindak asusila trus yg kena sypa korban atau pelaku ,netral,"['coba', 'deh', 'buat', 'yg', 'setuju', 'sama', 'permen', 'pasal', 'ini', 'kalo', 'si', 'korban', 'di', 'ancam', 'untk', 'bilang', 'kalo', 'tindakan', 'kekerasan', 'seksual', 'tsbt', 'atas', 'dasar', 'suka', 'sama', 'suka', 'trus', 'pelaku', 'nggak', 'kenai', 'permen', 'di', 'kampus', 'kenanya', 'pasal', 'tindak', 'a susila', 'trus', 'yg', 'kena', 'sypa', 'korban', 'atau', 'pelaku']","['coba', 'deh', 'setuju', 'permen', 'pasal', 'korban', 'ancam', 'untk', 'tindakan', 'kekerasan', 'seksual', 'tsbt', 'dasar', 'suka', 'suka', 'trus', 'pelaku', 'nggak', 'kenai', 'permen', 'kampus', 'kenanya', 'pasal', 'tindak', 'a susila', 'trus', 'kena', 'sypa', 'korban', 'pelaku']","['coba', 'deh', 'tuju', 'permen', 'pasal', 'korban', 'ancam', 'untk', 'tindak', 'keras', 'seksual', 'tsbt', 'dasar', 'suka', 'suka', 'trus', 'laku', 'nggak', 'kena', 'permen', 'kampus', 'kena', 'pasal', 'tindak', 'a susila', 'trus', 'kena', 'sypa', 'korban', 'laku']",coba deh tuju permen pasal korban ancam untk tindak keras seksual tsbt dasar suka suka trus laku nggak kena permen kampus kena pasal tindak a susila trus kena sypa korban laku
19,kan harus didefinisikan apa artinya perbuatan yg termasuk dlm kekerasan seksual dan definisinya ya memang tanpa persetujuan korban logika aja wajar kalimat itu harus dicantumkan ,positif,"['kan', 'hrs', 'didefinisikan', 'aoa', 'artinya', 'perbuatan', 'yg', 'termasuk', 'dlm', 'kekerasan', 'seksual', 'dn', 'definisinya', 'ya', 'memang', 'tanpa', 'persetujuan', 'korban', 'logika', 'aja', 'wajar', 'kalimat', 'itu', 'hrs', 'dicantumkan']","['hrs', 'didefinisikan', 'aoa', 'perbuatan', 'dlm', 'kekerasan', 'seksual', 'dn', 'definisinya', 'persetujuan', 'korban', 'logika', 'wajar', 'kalimat', 'hrs', 'dicantumkan']","['hrs', 'definisi', 'aoa', 'buat', 'dlm', 'keras', 'seksual', 'dn', 'definisi', 'tuju', 'korban', 'logika', 'wajar', 'kalimat', 'hrs', 'cantum']",hrs definisi aoa buat dlm keras seksual dn definisi tuju korban logika wajar kalimat hrs cantum
20, dmitrii yang senang mesum pasti marah dengan permendikbud karena mencolek dan meraba raba saja sudah ada sangsinya apalagi apalagi minta buka baju itu melanggar moral dan kuhp,positif,"['dmitrii', 'yg', 'senang', 'mesum', 'pasti', 'marah', 'dgn', 'permendikbud', 'krn', 'mencolek', 'dn', 'meraba', 'raba', 'saja', 'sdh', 'ada', 'sangsinya', 'apalagi', 'apalagi', 'minta', 'buka', 'baju', 'itu', 'melanggar', 'moril', 'dn', 'kuhp']","['dmitrii', 'senang', 'mesum', 'marah', 'permendikbud', 'mencolek', 'dn', 'meraba', 'raba', 'sangsinya', 'buka', 'baju', 'melanggar', 'moril', 'dn', 'kuhp']","['dmitrii', 'senang', 'mesum', 'marah', 'permendikbud', 'colek', 'dn', 'raba', 'raba', 'sangsi', 'buka', 'baju', 'langgar', 'moril', 'dn', 'kuhp']",dmitrii senang mesum marah permendikbud colek dn raba raba sangsi buka baju langgar moril dn kuhp
21, muhammad thohir oke sampai disini berarti permendikbud tersebut bentrok dengan uu tentang pornografi lainnya,netral,"['muhammad', 'thohir', 'oke', 'sampek', 'disini', 'berarti', 'permendikbud', 'tsb', 'bentrok', 'dgn', 'uu', 'tentang', 'pornografi', 'lainnya']","['muhammad', 'thohir', 'oke', 'sampek', 'permendikbud', 'tsb', 'bentrok', 'uu', 'pornografi']","['muhammad', 'thohir', 'oke', 'sampek', 'permendikbud', 'tsb', 'bentrok', 'uu', 'pornografi']",muhammad thohir oke sampek permendikbud tsb bentrok uu pornografi
22,asal suka sama suka tidak masalah bukan saya kan berseks bebas hanya mematuhi permendikbud membolehkannya ,positif,"['asal', 'suka', 'sama', 'suka', 'ndak', 'masalh', 'bukan', 'aq', 'kan', 'berseks', 'bebas', 'cuma', 'mematuhi', 'permendikbud', 'membolehkannya']","['suka', 'suka', 'ndak', 'masalh', 'aq', 'berseks', 'bebas', 'mematuhi', 'permendikbud', 'membolehkannya']","['suka', 'suka', 'ndak', 'masalh', 'aq', 'seks', 'bebas', 'patuh', 'permendikbud', 'boleh']",suka suka ndak masalh aq seks bebas patuh permendikbud boleh
23, dmitrii pasal mana yang bentrok coba sebutkan kalau kamu memeng ngerti jangan kamu hanya mengikuti ulama kadron,netral,"['dmitrii', 'pasal', 'mana', 'yg', 'bentrok', 'coba', 'sebutkan', 'klw', 'kamu', 'memeng', 'ngerti', 'jngan', 'kamu', 'cuma', 'mengikuti', 'ulama', 'kadron']","['dmitrii', 'pasal', 'bentrok', 'coba', 'sebutkan', 'klw', 'memeng', 'ngerti', 'jngan', 'mengikuti', 'ulama', 'kadron']","['dmitrii', 'pasal', 'bentrok', 'coba', 'sebut', 'klw', 'memeng', 'ngerti', 'jngan', 'ikut', 'ulama', 'kadron']",dmitrii pasal bentrok coba sebut klw memeng ngerti jngan ikut ulama kadron
24, dmitrii itu isi otak mesumnya ulama kadron yang tidak ada di dalam permendikbud,negatif,"['dmitrii', 'itu', 'isi', 'otak', 'mesumnya', 'ulama', 'kadron', 'yg', 'ndak', 'ada', 'di', 'dalem', 'permendikbud']","['dmitrii', 'isi', 'otak', 'mesumnya', 'ulama', 'kadron', 'ndak', 'dalem', 'permendikbud']","['dmitrii', 'isi', 'otak', 'mesum', 'ulama', 'kadron', 'ndak', 'dalem', 'permendikbud']",dmitrii isi otak mesum ulama kadron ndak dalem permendikbud
25, muhammad thohir ini contoh kuhpnya setiap orang yang melakukan persetubuhan dengan orang yang bukan suami atau istrinya dipidana karena perzinaan dengan pidana penjara paling lama  satu tahun atau denda kategori ii permendikbud  menyentuh mengusap meraba memegang memeluk mencium dan atau menggosokkan bagian tubuhnya pada tubuh korban tanpa persetujuan korban membuka pakaian korban tanpa persetujuan korban di kuhp sudah dinyatakan secara gamblang jelas dan tidak ada keambiguan atau multitafsir bahwa seks bebas dilarang sedangkan di permendikbud  didapati boleh melakukan kegiatan seksual atas persetujuan korban seperti mencium dan menggesekkan kemaluan jadi sah sah saja bukan kalau saya mengimplementasikan permendikbud  walaupun bentrok dengan kuhp jadi yg disalahkan kuhp nya atau permendikbudnya yg ambigu dan perlu direvisi itu ,netral,"['muhammad', 'thohir', 'ini', 'contoh', 'kuhpnya', 'setiap', 'org', 'yg', 'melakukan', 'persetubuhan', 'dgn', 'org', 'yg', 'bukan', 'suami', 'atau', 'istrinya', 'dipidana', 'krn', 'perzinaan', 'dgn', 'pidana', 'penjara', 'paling', 'lama', 'satu', 'tahun', 'atau', 'denda', 'katagori', 'ii', 'permendikbud', 'menyentuh', 'mengusap', 'meraba', 'memegang', 'memeluk', 'mencium', 'dn', 'atau', 'menggosokkan', 'bagian', 'tubuhnya', 'pada', 'tubuh', 'korban', 'tanpa', 'persetujuan', 'korban', 'membuka', 'pakaian', 'korban', 'tanpa', 'persetujuan', 'korban', 'di', 'kuhp', 'sdh', 'dinyatakan', 'secara', 'gamblang', 'jelas', 'dn', 'ndak', 'ada', 'keambiguan', 'atau', 'multitafsir', 'bahwa', 'sex', 'bebas', 'dilarang', 'sedangkan', 'di', 'permendikbud', 'didapati', 'boleh', 'melakukan', 'kegiatan', 'seksual', 'atas', 'persetujuan', 'korban', 'kayak', 'mencium', 'dn', 'menggesekkan', 'kemaluan', 'jadi', 'syah', 'syah', 'saja', 'bukan', 'klw', 'aq', 'mengimplementasikan', 'permendikbud', 'walau pun', 'bentrok', 'dgn', 'kuhp', 'jadi', 'yg', 'disalahkan', 'kuhp', 'nya', 'atau', 'permendikbudnya', 'yg', 'ambigu', 'dn', 'perlu', 'direvisi', 'itu']","['muhammad', 'thohir', 'contoh', 'kuhpnya', 'org', 'persetubuhan', 'org', 'suami', 'istrinya', 'dipidana', 'perzinaan', 'pidana', 'penjara', 'denda', 'katagori', 'ii', 'permendikbud', 'menyentuh', 'mengusap', 'meraba', 'memegang', 'memeluk', 'mencium', 'dn', 'menggosokkan', 'tubuhnya', 'tubuh', 'korban', 'persetujuan', 'korban', 'membuka', 'pakaian', 'korban', 'persetujuan', 'korban', 'kuhp', 'dinyatakan', 'gamblang', 'dn', 'ndak', 'keambiguan', 'multitafsir', 'sex', 'bebas', 'dilarang', 'permendikbud', 'didapati', 'kegiatan', 'seksual', 'persetujuan', 'korban', 'kayak', 'mencium', 'dn', 'menggesekkan', 'kemaluan', 'syah', 'syah', 'klw', 'aq', 'mengimplementasikan', 'permendikbud', 'walau pun', 'bentrok', 'kuhp', 'disalahkan', 'kuhp', 'permendikbudnya', 'ambigu', 'dn', 'direvisi']","['muhammad', 'thohir', 'contoh', 'kuhpnya', 'org', 'tubuh', 'org', 'suami', 'istri', 'pidana', 'zina', 'pidana', 'penjara', 'denda', 'katagori', 'ii', 'permendikbud', 'sentuh', 'usap', 'raba', 'pegang', 'peluk', 'cium', 'dn', 'gosok', 'tubuh', 'tubuh', 'korban', 'tuju', 'korban', 'buka', 'pakai', 'korban', 'tuju', 'korban', 'kuhp', 'nyata', 'gamblang', 'dn', 'ndak', 'ambigu', 'multitafsir', 'sex', 'bebas', 'larang', 'permendikbud', 'dapat', 'giat', 'seksual', 'tuju', 'korban', 'kayak', 'cium', 'dn', 'gesek', 'malu', 'syah', 'syah', 'klw', 'aq', 'implementasi', 'permendikbud', 'walau pun', 'bentrok', 'kuhp', 'salah', 'kuhp', 'permendikbudnya', 'ambigu', 'dn', 'revisi']",muhammad thohir contoh kuhpnya org tubuh org suami istri pidana zina pidana penjara denda katagori ii permendikbud sentuh usap raba pegang peluk cium dn gosok tubuh tubuh korban tuju korban buka pakai korban tuju korban kuhp nyata gamblang dn ndak ambigu multitafsir sex bebas larang permendikbud dapat giat seksual tuju korban kayak cium dn gesek malu syah syah klw aq implementasi permendikbud walau pun bentrok kuhp salah kuhp permendikbudnya ambigu dn revisi
