,Komentar,Label,TOKENIZATION,STOP_REMOVAL,STEMMER,Komentar_Final
217,partai korupsi sapi berkedok holaqoh juz amma,netral,"['partai', 'korupsi', 'sapi', 'berkedok', 'holaqoh', 'juz', 'amma']","['partai', 'korupsi', 'sapi', 'berkedok', 'holaqoh', 'juz', 'amma']","['partai', 'korupsi', 'sapi', 'kedok', 'holaqoh', 'juz', 'amma']",partai korupsi sapi kedok holaqoh juz amma
218,makanya belajar hukum om biar tau baca produk hukum bukan seperti baca novel ,negatif,"['makanya', 'belajar', 'hukum', 'om', 'biar', 'tau', 'baca', 'produk', 'hukum', 'bukan', 'kayak', 'baca', 'novel']","['belajar', 'hukum', 'om', 'baca', 'produk', 'hukum', 'kayak', 'baca', 'novel']","['ajar', 'hukum', 'om', 'baca', 'produk', 'hukum', 'kayak', 'baca', 'novel']",ajar hukum om baca produk hukum kayak baca novel
219,kalo ada persetujuan itu bukan kekerasan seksual perbuatan seks diluar nikah itu bukan kekerasan seksual tapi perbuatan yang melanggar norma agama makanya kalo baca tuh yang bener ,positif,"['kalo', 'ada', 'persetujuan', 'itu', 'bukan', 'kekerasan', 'seksual', 'perbuatan', 'sex', 'diluar', 'nikah', 'itu', 'bukan', 'kekerasan', 'seksual', 'tapi', 'perbuatan', 'yg', 'melanggar', 'norma', 'agama', 'makanya', 'kalo', 'baca', 'tuh', 'yg', 'bener']","['persetujuan', 'kekerasan', 'seksual', 'perbuatan', 'sex', 'diluar', 'nikah', 'kekerasan', 'seksual', 'perbuatan', 'melanggar', 'norma', 'agama', 'baca', 'bener']","['tuju', 'keras', 'seksual', 'buat', 'sex', 'luar', 'nikah', 'keras', 'seksual', 'buat', 'langgar', 'norma', 'agama', 'baca', 'bener']",tuju keras seksual buat sex luar nikah keras seksual buat langgar norma agama baca bener
220,toh consent itu bukan hal baru di indonesia mengambil barang orang tanpa izin consent bisa dikategorikan sebagai tindakan pencurian ,negatif,"['toh', 'consent', 'itu', 'bukan', 'hal', 'baru', 'di', 'indonesia', 'mengambil', 'brng', 'org', 'tanpa', 'ijin', 'consent', 'bsa', 'dikategorikan', 'sebagai', 'tindakan', 'pencurian']","['consent', 'indonesia', 'mengambil', 'brng', 'org', 'ijin', 'consent', 'bsa', 'dikategorikan', 'tindakan', 'pencurian']","['consent', 'indonesia', 'ambil', 'brng', 'org', 'ijin', 'consent', 'bsa', 'kategori', 'tindak', 'curi']",consent indonesia ambil brng org ijin consent bsa kategori tindak curi
221,woahh parah anjir,netral,"['woahh', 'parah', 'anjir']","['woahh', 'parah', 'anjir']","['woahh', 'parah', 'anjir']",woahh parah anjir
222,apakah sudah diberitahukan ke pihak sekolah atau kampus ,netral,"['apakah', 'sdh', 'diberitahukan', 'ke', 'fihak', 'sekolah', 'atau', 'kampus']","['diberitahukan', 'fihak', 'sekolah', 'kampus']","['diberitahukan', 'fihak', 'sekolah', 'kampus']",diberitahukan fihak sekolah kampus
223, aldo binar udh clear bro dosennya udh di depak sm pihak kampus yg penting ada bukti aja dari percakapan tsb ,positif,"['aldo', 'binar', 'udh', 'clear', 'bro', 'dosennya', 'udh', 'di', 'depak', 'sm', 'fihak', 'kampus', 'yg', 'penting', 'ada', 'bukti', 'aja', 'dari', 'percakapan', 'tsb']","['aldo', 'binar', 'udh', 'clear', 'dosennya', 'udh', 'depak', 'sm', 'fihak', 'kampus', 'bukti', 'percakapan', 'tsb']","['aldo', 'binar', 'udh', 'clear', 'dosen', 'udh', 'depak', 'sm', 'fihak', 'kampus', 'bukti', 'cakap', 'tsb']",aldo binar udh clear dosen udh depak sm fihak kampus bukti cakap tsb
224,udh baca uu nya klo dihilangkan kata tanpa persetujuan maka bisa dikategorikan pelecehan seksual setelah ada kontak fisik tp klo ada kata tanpa persetujuan maka ketika pelaku baru menawarkan transaksi seks misal lu ditawarin dosen nilai tp minta lu foto telanjang baru verbal lu udh bisa jd kan alat lapor karena transaksi yg dilakukan tanpa persetujuan lu gw lihat lu make foto ginian pasti kemampuan pemahaman seharusnya udh diatas rata dong,netral,"['udh', 'baca', 'uu', 'nya', 'klo', 'dihilangkan', 'kata', 'tanpa', 'persetujuan', 'maka', 'bsa', 'dikategorikan', 'pelecehan', 'seksual', 'setelah', 'ada', 'kontak', 'pisik', 'tp', 'klo', 'ada', 'kata', 'tanpa', 'persetujuan', 'maka', 'ketika', 'pelaku', 'baru', 'menawarkan', 'transaksi', 'sex', 'missal', 'lu', 'ditawarin', 'dosen', 'nilai', 'tp', 'minta', 'lu', 'photo', 'telanjang', 'baru', 'verbal', 'lu', 'udh', 'bsa', 'jd', 'kan', 'alat', 'lapor', 'krn', 'transaksi', 'yg', 'dilakukan', 'tanpa', 'persetujuan', 'lu', 'gw', 'lihat', 'lu', 'make', 'photo', 'ginian', 'pasti', 'kemampuan', 'pemahaman', 'seharusnya', 'udh', 'diatas', 'rata', 'dong']","['udh', 'baca', 'uu', 'dihilangkan', 'persetujuan', 'bsa', 'dikategorikan', 'pelecehan', 'seksual', 'kontak', 'pisik', 'tp', 'persetujuan', 'pelaku', 'menawarkan', 'transaksi', 'sex', 'missal', 'lu', 'ditawarin', 'dosen', 'nilai', 'tp', 'lu', 'photo', 'telanjang', 'verbal', 'lu', 'udh', 'bsa', 'jd', 'alat', 'lapor', 'transaksi', 'persetujuan', 'lu', 'gw', 'lihat', 'lu', 'make', 'photo', 'ginian', 'kemampuan', 'pemahaman', 'udh', 'diatas']","['udh', 'baca', 'uu', 'hilang', 'tuju', 'bsa', 'kategori', 'leceh', 'seksual', 'kontak', 'pisik', 'tp', 'tuju', 'laku', 'tawar', 'transaksi', 'sex', 'missal', 'lu', 'ditawarin', 'dosen', 'nilai', 'tp', 'lu', 'photo', 'telanjang', 'verbal', 'lu', 'udh', 'bsa', 'jd', 'alat', 'lapor', 'transaksi', 'tuju', 'lu', 'gw', 'lihat', 'lu', 'make', 'photo', 'ginian', 'mampu', 'paham', 'udh', 'atas']",udh baca uu hilang tuju bsa kategori leceh seksual kontak pisik tp tuju laku tawar transaksi sex missal lu ditawarin dosen nilai tp lu photo telanjang verbal lu udh bsa jd alat lapor transaksi tuju lu gw lihat lu make photo ginian mampu paham udh atas
225, alluxes ohh jadi sebelum ada permen ini kalo dosen nawarin seks aman ya bro gak bisa dijadiin alat bukti ,netral,"['alluxes', 'ohh', 'jadi', 'sebelum', 'ada', 'permen', 'ini', 'kalo', 'dosen', 'nawarin', 'sex', 'aman', 'ya', 'bro', 'gak', 'bsa', 'dijadiin', 'alat', 'bukti']","['alluxes', 'ohh', 'permen', 'dosen', 'nawarin', 'sex', 'aman', 'gak', 'bsa', 'dijadiin', 'alat', 'bukti']","['alluxes', 'ohh', 'permen', 'dosen', 'nawarin', 'sex', 'aman', 'gak', 'bsa', 'dijadiin', 'alat', 'bukti']",alluxes ohh permen dosen nawarin sex aman gak bsa dijadiin alat bukti
226, awi asnawi gak bisa selama belum ada kontak fisik teman gw dlu korban  kita mau laporin pun apa yg bisa dilakukan dan dasar apa makanya dalam permendikbud bahkan catt calling aja bisa dianggap pelecehan ,positif,"['awi', 'asnawi', 'gak', 'bsa', 'selama', 'blm', 'ada', 'kontak', 'pisik', 'teman', 'gw', 'dlu', 'korban', 'kita', 'mau', 'laporin', 'pun', 'aoa', 'yg', 'bsa', 'dilakukan', 'dn', 'dasar', 'aoa', 'makanya', 'dalem', 'permendikbud', 'bahkan', 'catt', 'calling', 'aja', 'bsa', 'dianggap', 'pelecehan']","['awi', 'asnawi', 'gak', 'bsa', 'blm', 'kontak', 'pisik', 'teman', 'gw', 'dlu', 'korban', 'laporin', 'aoa', 'bsa', 'dn', 'dasar', 'aoa', 'dalem', 'permendikbud', 'catt', 'calling', 'bsa', 'dianggap', 'pelecehan']","['awi', 'asnawi', 'gak', 'bsa', 'blm', 'kontak', 'pisik', 'teman', 'gw', 'dlu', 'korban', 'laporin', 'aoa', 'bsa', 'dn', 'dasar', 'aoa', 'dalem', 'permendikbud', 'catt', 'calling', 'bsa', 'anggap', 'leceh']",awi asnawi gak bsa blm kontak pisik teman gw dlu korban laporin aoa bsa dn dasar aoa dalem permendikbud catt calling bsa anggap leceh
227, alluxes mereka kurang literasi tapi pas diedukasi malah nyerang balik ,negatif,"['alluxes', 'mereka', 'kurang', 'literasi', 'tapi', 'pas', 'diedukasi', 'mlh', 'nyerang', 'balik']","['alluxes', 'literasi', 'diedukasi', 'mlh', 'nyerang']","['alluxes', 'literasi', 'edukasi', 'mlh', 'nyerang']",alluxes literasi edukasi mlh nyerang
228, aufa billah selain kurang literasi mereka ini juga tipe org yg mikirnya ngeres mulu bro jd susah memproses positif informasi yg berkaitan dengan seksual ,negatif,"['aufa', 'billah', 'selain', 'kurang', 'literasi', 'mereka', 'ini', 'jga', 'tipe', 'org', 'yg', 'mikirnya', 'ngeres', 'mulu', 'bro', 'jd', 'susah', 'memproses', 'positiv', 'informasi', 'yg', 'berkaitan', 'dgn', 'seksual']","['aufa', 'billah', 'literasi', 'jga', 'tipe', 'org', 'mikirnya', 'ngeres', 'mulu', 'jd', 'susah', 'memproses', 'positiv', 'informasi', 'berkaitan', 'seksual']","['aufa', 'billah', 'literasi', 'jga', 'tipe', 'org', 'mikirnya', 'ngeres', 'mulu', 'jd', 'susah', 'proses', 'positiv', 'informasi', 'kait', 'seksual']",aufa billah literasi jga tipe org mikirnya ngeres mulu jd susah proses positiv informasi kait seksual
229, alluxes iya benar apa apa dikaitkan dengan pro zina  pasal kok dibebankan untuk seluruh perbuatan asusila ada ada aja cara berfikirnya ,negatif,"['alluxes', 'iya', 'bnr', 'aoa', 'aoa', 'dikaitkan', 'dgn', 'pro', 'zinah', 'pasal', 'kok', 'dibebankan', 'untk', 'seluruh', 'perbuatan', 'a susila', 'ada', 'ada', 'aja', 'cara', 'berfikirnya']","['alluxes', 'iya', 'bnr', 'aoa', 'aoa', 'dikaitkan', 'pro', 'zinah', 'pasal', 'dibebankan', 'untk', 'perbuatan', 'a susila', 'berfikirnya']","['alluxes', 'iya', 'bnr', 'aoa', 'aoa', 'kait', 'pro', 'zinah', 'pasal', 'beban', 'untk', 'buat', 'a susila', 'berfikirnya']",alluxes iya bnr aoa aoa kait pro zinah pasal beban untk buat a susila berfikirnya
230,pelecehan verbal itu udh ada pasalnya  kuhp dan  kuhp itu udh pelecehan verbal tanpa ada sentuhan ato secara interface,negatif,"['pelecehan', 'verbal', 'itu', 'udh', 'ada', 'pasalnya', 'kuhp', 'dn', 'kuhp', 'itu', 'udh', 'pelecehan', 'verbal', 'tanpa', 'ada', 'sentuhan', 'ato', 'secara', 'interface']","['pelecehan', 'verbal', 'udh', 'pasalnya', 'kuhp', 'dn', 'kuhp', 'udh', 'pelecehan', 'verbal', 'sentuhan', 'ato', 'interface']","['leceh', 'verbal', 'udh', 'pasal', 'kuhp', 'dn', 'kuhp', 'udh', 'leceh', 'verbal', 'sentuh', 'ato', 'interface']",leceh verbal udh pasal kuhp dn kuhp udh leceh verbal sentuh ato interface
231,pendapat saya zina atas sadar suka sama suka tanpa ada tekanan kekerasan maka perzinahan tidak akan terjadi perbutan ini membutuhkan tekanan kekerasan,positif,"['pendapat', 'aq', 'zinah', 'atas', 'sadar', 'suka', 'sama', 'suka', 'tanpa', 'ada', 'tekanan', 'kekerasan', 'maka', 'perzinahan', 'ndak', 'akan', 'terjadi', 'perbutan', 'ini', 'membutuhkan', 'tekanan', 'kekerasan']","['pendapat', 'aq', 'zinah', 'sadar', 'suka', 'suka', 'tekanan', 'kekerasan', 'perzinahan', 'ndak', 'perbutan', 'membutuhkan', 'tekanan', 'kekerasan']","['dapat', 'aq', 'zinah', 'sadar', 'suka', 'suka', 'tekan', 'keras', 'perzinahan', 'ndak', 'perbutan', 'butuh', 'tekan', 'keras']",dapat aq zinah sadar suka suka tekan keras perzinahan ndak perbutan butuh tekan keras
232,judulnya bagus isinya melegalkan kekerasan tolong dibaca isinya dengan teliti pak mentri,positif,"['judulnya', 'oke', 'isinya', 'melegalkan', 'kekerasan', 'tlg', 'dibaca', 'isinya', 'dgn', 'teliti', 'pak', 'mentri']","['judulnya', 'oke', 'isinya', 'melegalkan', 'kekerasan', 'tlg', 'dibaca', 'isinya', 'teliti', 'mentri']","['judul', 'oke', 'isi', 'legal', 'keras', 'tlg', 'baca', 'isi', 'teliti', 'tri']",judul oke isi legal keras tlg baca isi teliti tri
233,tujuannya baik tapi bagaimana mas mentri menjawab frasa dalam permendikbud tentang tanpa persetujuan artinya kalau dilakukan dengan persetujuan maka dibolehkan ,positif,"['tujuannya', 'bae', 'tapi', 'bagai mana', 'mas', 'mentri', 'menjawab', 'frase', 'dalem', 'permendikbud', 'tentang', 'tanpa', 'persetujuan', 'artinya', 'klw', 'dilakukan', 'dgn', 'persetujuan', 'maka', 'dibolehkan']","['tujuannya', 'bae', 'bagai mana', 'mas', 'mentri', 'frase', 'dalem', 'permendikbud', 'persetujuan', 'klw', 'persetujuan', 'dibolehkan']","['tuju', 'bae', 'bagai mana', 'mas', 'tri', 'frase', 'dalem', 'permendikbud', 'tuju', 'klw', 'tuju', 'boleh']",tuju bae bagai mana mas tri frase dalem permendikbud tuju klw tuju boleh
234,banyak bacot nadiem jelas salah ngeyel lo,negatif,"['byk', 'bacot', 'nadiem', 'jelas', 'salah', 'ngeyel', 'lo']","['byk', 'bacot', 'nadiem', 'salah', 'ngeyel', 'lo']","['byk', 'bacot', 'nadiem', 'salah', 'ngeyel', 'lo']",byk bacot nadiem salah ngeyel lo
235,munkin makarim sukak sex,negatif,"['munkin', 'makarim', 'sukak', 'sex']","['munkin', 'makarim', 'sukak', 'sex']","['munkin', 'makarim', 'sukak', 'sex']",munkin makarim sukak sex
236,makanya hrs nya kl terjadi kekerasan sex pd wanita apapun alasan nya kl terbukti disetubuhin perempuan harus laki laki yg di hukum berat walaupun perempuan yg ngasi barang nya kl laki laki menjaga jakar nya pasti tdk akan terjadi apalagi kl guru polisi melakukan kekerasan sex harus di pecat dan hukum seumur hidup ,positif,"['makanya', 'hrs', 'nya', 'kl', 'terjadi', 'kekerasan', 'sex', 'pd', 'wanita', 'apapun', 'alesanya', 'nya', 'kl', 'terbukti', 'disetubuhin', 'perempuan', 'hrs', 'laki', 'laki', 'yg', 'di', 'hukum', 'berat', 'walau pun', 'perempuan', 'yg', 'ngasi', 'brng', 'nya', 'kl', 'laki', 'laki', 'menjaga', 'jakar', 'nya', 'pasti', 'tdk', 'akan', 'terjadi', 'apalagi', 'kl', 'guru', 'polisi', 'melakukan', 'kekerasan', 'sex', 'hrs', 'di', 'pecat', 'dn', 'hukum', 'seumur', 'hidup']","['hrs', 'kl', 'kekerasan', 'sex', 'pd', 'wanita', 'apapun', 'alesanya', 'kl', 'terbukti', 'disetubuhin', 'perempuan', 'hrs', 'laki', 'laki', 'hukum', 'berat', 'walau pun', 'perempuan', 'ngasi', 'brng', 'kl', 'laki', 'laki', 'menjaga', 'jakar', 'tdk', 'kl', 'guru', 'polisi', 'kekerasan', 'sex', 'hrs', 'pecat', 'dn', 'hukum', 'seumur', 'hidup']","['hrs', 'kl', 'keras', 'sex', 'pd', 'wanita', 'apa', 'alesanya', 'kl', 'bukti', 'disetubuhin', 'perempuan', 'hrs', 'laki', 'laki', 'hukum', 'berat', 'walau pun', 'perempuan', 'ngasi', 'brng', 'kl', 'laki', 'laki', 'jaga', 'jakar', 'tdk', 'kl', 'guru', 'polisi', 'keras', 'sex', 'hrs', 'pecat', 'dn', 'hukum', 'umur', 'hidup']",hrs kl keras sex pd wanita apa alesanya kl bukti disetubuhin perempuan hrs laki laki hukum berat walau pun perempuan ngasi brng kl laki laki jaga jakar tdk kl guru polisi keras sex hrs pecat dn hukum umur hidup
237,mengapa tokoh wanitanya diam terus ada apa ,netral,"['mengapa', 'tokoh', 'wanitanya', 'diem', 'terus', 'ada', 'aoa']","['tokoh', 'wanitanya', 'diem', 'aoa']","['tokoh', 'wanita', 'diem', 'aoa']",tokoh wanita diem aoa
238,ngenyel banget sih para kadrun ama permendikbud ini tujuannya udah jelas untuk melindungi korban dari kekerasan seksual di lingkungan perguruan tinggi di dalam permendikbud itu tidak mengarah ke zina hadehh hadeh bikin negara yang saya sayangi ini jadi ribet kalau ngomongin peraturan zina sono usul ke dpr untuk dibuat peraturannya jangan disangkut pautkan ama ruang lingkup konteks permendikbud  tahun  ini ,negatif,"['ngenyel', 'bgt', 'sih', 'para', 'kadrun', 'ama', 'permendikbud', 'ini', 'tujuannya', 'udah', 'jelas', 'untk', 'melindungi', 'korban', 'dari', 'kekerasan', 'seksual', 'di', 'lingkungan', 'perguruan', 'tinggi', 'di', 'dalem', 'permendikbud', 'itu', 'ndak', 'mengarah', 'ke', 'zinah', 'hadehh', 'hadeh', 'bikin', 'negara', 'yg', 'aq', 'sayangi', 'ini', 'jadi', 'ribet', 'klw', 'ngomongin', 'peraturan', 'zinah', 'sono', 'usul', 'ke', 'dpr', 'untk', 'dibuat', 'peraturannya', 'jngan', 'disangkut', 'pautkan', 'ama', 'ruang', 'lingkup', 'konteks', 'permendikbud', 'tahun', 'ini']","['ngenyel', 'bgt', 'kadrun', 'ama', 'permendikbud', 'tujuannya', 'udah', 'untk', 'melindungi', 'korban', 'kekerasan', 'seksual', 'lingkungan', 'perguruan', 'dalem', 'permendikbud', 'ndak', 'mengarah', 'zinah', 'hadehh', 'hadeh', 'negara', 'aq', 'sayangi', 'ribet', 'klw', 'ngomongin', 'peraturan', 'zinah', 'sono', 'usul', 'dpr', 'untk', 'peraturannya', 'jngan', 'disangkut', 'pautkan', 'ama', 'ruang', 'lingkup', 'konteks', 'permendikbud']","['ngenyel', 'bgt', 'kadrun', 'ama', 'permendikbud', 'tuju', 'udah', 'untk', 'lindung', 'korban', 'keras', 'seksual', 'lingkung', 'guru', 'dalem', 'permendikbud', 'ndak', 'arah', 'zinah', 'hadehh', 'hadeh', 'negara', 'aq', 'sayang', 'ribet', 'klw', 'ngomongin', 'atur', 'zinah', 'sono', 'usul', 'dpr', 'untk', 'atur', 'jngan', 'sangkut', 'paut', 'ama', 'ruang', 'lingkup', 'konteks', 'permendikbud']",ngenyel bgt kadrun ama permendikbud tuju udah untk lindung korban keras seksual lingkung guru dalem permendikbud ndak arah zinah hadehh hadeh negara aq sayang ribet klw ngomongin atur zinah sono usul dpr untk atur jngan sangkut paut ama ruang lingkup konteks permendikbud
239,klo begitu supaya tidak terjadi hal hal yg tidak diinginkan dipisah saja kelas khusus laki laki dan kelas khusus perempuan macam gerbong kereta itu ,netral,"['klo', 'begitu', 'supaya', 'ndak', 'terjadi', 'hal', 'hal', 'yg', 'ndak', 'diinginkan', 'dipisah', 'saja', 'kelas', 'khusus', 'laki', 'laki', 'dn', 'kelas', 'khusus', 'perempuan', 'macem', 'gerbong', 'kereta', 'itu']","['ndak', 'ndak', 'dipisah', 'kelas', 'khusus', 'laki', 'laki', 'dn', 'kelas', 'khusus', 'perempuan', 'macem', 'gerbong', 'kereta']","['ndak', 'ndak', 'pisah', 'kelas', 'khusus', 'laki', 'laki', 'dn', 'kelas', 'khusus', 'perempuan', 'macem', 'gerbong', 'kereta']",ndak ndak pisah kelas khusus laki laki dn kelas khusus perempuan macem gerbong kereta
240,kali ini mahasiswa menolak di tunggangi ulama kadron otak mesum yang selalu memahami salah permendikbud katanya melegalkan sek bebas dan lgbt ,negatif,"['kali', 'ini', 'mahasiswa', 'menolak', 'di', 'tunggangi', 'ulama', 'kadron', 'otak', 'mesum', 'yg', 'sllu', 'memahami', 'salah', 'permendikbud', 'katanya', 'melegalkan', 'sek', 'bebas', 'dn', 'lgbt']","['kali', 'mahasiswa', 'menolak', 'tunggangi', 'ulama', 'kadron', 'otak', 'mesum', 'sllu', 'memahami', 'salah', 'permendikbud', 'melegalkan', 'sek', 'bebas', 'dn', 'lgbt']","['kali', 'mahasiswa', 'tolak', 'tunggang', 'ulama', 'kadron', 'otak', 'mesum', 'sllu', 'paham', 'salah', 'permendikbud', 'legal', 'sek', 'bebas', 'dn', 'lgbt']",kali mahasiswa tolak tunggang ulama kadron otak mesum sllu paham salah permendikbud legal sek bebas dn lgbt
241,udah diperintahkan beliau pak presiden jokowi yang tanggung jawab para pendidiknya ,netral,"['udah', 'diperintahkan', 'beliau', 'pak', 'presiden', 'jokowi', 'yg', 'tanggung', 'jawab', 'para', 'pendidiknya']","['udah', 'diperintahkan', 'beliau', 'presiden', 'jokowi', 'tanggung', 'pendidiknya']","['udah', 'perintah', 'beliau', 'presiden', 'jokowi', 'tanggung', 'didik']",udah perintah beliau presiden jokowi tanggung didik
242,semangat itu kita hargai ttp mslhx adh norma yg tertulis terhadap frasa dengan persetujuan itulah bukti legalx sex dgn persetujuan ,positif,"['semangat', 'itu', 'kita', 'hargai', 'ttp', 'mslhx', 'adh', 'norma', 'yg', 'tertulis', 'terhadap', 'frase', 'dgn', 'persetujuan', 'itulah', 'bukti', 'legalx', 'sex', 'dgn', 'persetujuan']","['semangat', 'hargai', 'ttp', 'mslhx', 'adh', 'norma', 'tertulis', 'frase', 'persetujuan', 'bukti', 'legalx', 'sex', 'persetujuan']","['semangat', 'harga', 'ttp', 'mslhx', 'adh', 'norma', 'tulis', 'frase', 'tuju', 'bukti', 'legalx', 'sex', 'tuju']",semangat harga ttp mslhx adh norma tulis frase tuju bukti legalx sex tuju
243,kalau tubuhmu di bungkus seperti permen lollipop siapa yg gak tergiur udah di bungkus juga masih kelihatan bentuknya ya kan makanya di tutup bukan di bungkus paham sampai sini mahaciwi ,positif,"['klw', 'tubuhmu', 'di', 'bungkus', 'kayak', 'permen', 'lollipop', 'siapa', 'yg', 'gak', 'tergiur', 'udah', 'di', 'bungkus', 'jga', 'masih', 'kelihatan', 'bentuknya', 'ya', 'kan', 'makanya', 'di', 'tutup', 'bukan', 'di', 'bungkus', 'faham', 'sampek', 'sini', 'mahaciwi']","['klw', 'tubuhmu', 'bungkus', 'kayak', 'permen', 'lollipop', 'gak', 'tergiur', 'udah', 'bungkus', 'jga', 'bentuknya', 'tutup', 'bungkus', 'faham', 'sampek', 'mahaciwi']","['klw', 'tubuh', 'bungkus', 'kayak', 'permen', 'lollipop', 'gak', 'giur', 'udah', 'bungkus', 'jga', 'bentuk', 'tutup', 'bungkus', 'faham', 'sampek', 'mahaciwi']",klw tubuh bungkus kayak permen lollipop gak giur udah bungkus jga bentuk tutup bungkus faham sampek mahaciwi
244,ojk ga berani tutup pinjol yg legal pdhl praktek nya bunga pinjol legal tinghi bngt mungkin ojk merasa ngga pernah dirugikan oleh pinjol jadinya ngga penting bngt mikirin pinjol bahasa lampau mengatakan emang guwe pikirin ,netral,"['ojk', 'ga', 'berani', 'tutup', 'pinjol', 'yg', 'legal', 'pdhl', 'praktek', 'nya', 'bunga', 'pinjol', 'legal', 'tinghi', 'bngt', 'mungkin', 'ojk', 'merasa', 'ngga', 'pernah', 'dirugikan', 'oleh', 'pinjol', 'jadinya', 'ngga', 'penting', 'bngt', 'mikirin', 'pinjol', 'bahasa', 'lampau', 'mengatakan', 'emang', 'guwe', 'pikirin']","['ojk', 'ga', 'berani', 'tutup', 'pinjol', 'legal', 'pdhl', 'praktek', 'bunga', 'pinjol', 'legal', 'tinghi', 'bngt', 'ojk', 'ngga', 'dirugikan', 'pinjol', 'ngga', 'bngt', 'mikirin', 'pinjol', 'bahasa', 'lampau', 'emang', 'guwe', 'pikirin']","['ojk', 'ga', 'berani', 'tutup', 'pinjol', 'legal', 'pdhl', 'praktek', 'bunga', 'pinjol', 'legal', 'tinghi', 'bngt', 'ojk', 'ngga', 'rugi', 'pinjol', 'ngga', 'bngt', 'mikirin', 'pinjol', 'bahasa', 'lampau', 'emang', 'guwe', 'pikirin']",ojk ga berani tutup pinjol legal pdhl praktek bunga pinjol legal tinghi bngt ojk ngga rugi pinjol ngga bngt mikirin pinjol bahasa lampau emang guwe pikirin
245,real bgt kekerasan seksual dikampus sdh darurat sekali kenapa ada oknum yg tdk setuju dg permendikbud ini dg alasan konotasi kata menghalalkan zina tragis sekali negri ini,positif,"['riil', 'bgt', 'kekerasan', 'seksual', 'dikampus', 'sdh', 'darurat', 'sekali', 'knp', 'ada', 'oknum', 'yg', 'tdk', 'setuju', 'dg', 'permendikbud', 'ini', 'dg', 'alesanya', 'konotasi', 'kata', 'menghalalkan', 'zinah', 'tragis', 'sekali', 'negri', 'ini']","['riil', 'bgt', 'kekerasan', 'seksual', 'dikampus', 'darurat', 'knp', 'oknum', 'tdk', 'setuju', 'permendikbud', 'alesanya', 'konotasi', 'menghalalkan', 'zinah', 'tragis', 'negri']","['riil', 'bgt', 'keras', 'seksual', 'kampus', 'darurat', 'knp', 'oknum', 'tdk', 'tuju', 'permendikbud', 'alesanya', 'konotasi', 'halal', 'zinah', 'tragis', 'negri']",riil bgt keras seksual kampus darurat knp oknum tdk tuju permendikbud alesanya konotasi halal zinah tragis negri
246,ini bikin ruu jangan disamain kyk bikin apps dong hehe kata bukan tanpa persetujuan mirip waktu kita baru install apps baru di smartphone hihihi ,netral,"['ini', 'bikin', 'ruu', 'jngan', 'disamain', 'kyk', 'bikin', 'apps', 'dong', 'hehe', 'kata', 'bukan', 'tanpa', 'persetujuan', 'mirip', 'waktu', 'kita', 'baru', 'install', 'apps', 'baru', 'di', 'smartphone', 'hihihi']","['ruu', 'jngan', 'disamain', 'kyk', 'apps', 'persetujuan', 'install', 'apps', 'smartphone', 'hihihi']","['ruu', 'jngan', 'disamain', 'kyk', 'apps', 'tuju', 'install', 'apps', 'smartphone', 'hihihi']",ruu jngan disamain kyk apps tuju install apps smartphone hihihi
247,permendikbudristek ini udah pantas di terapkan namun klu dengan cara pemaksaan dan kekerasan alias pemerkosaan nggak bisa di benarkan terkecuali keduanya sama sama suka dan sama sama senang bisa di terapkan permennya begitu pak terapkan saja asalkan sesuai dengan kaidah kaidah hukum dan norma norma kesopanan alias jangan di pertontonkan ,positif,"['permendikbudristek', 'ini', 'udah', 'pantas', 'di', 'terapkan', 'namun', 'klu', 'dgn', 'cara', 'pemaksaan', 'dn', 'kekerasan', 'alias', 'pemerkosaan', 'nggak', 'bsa', 'di', 'benarkan', 'terkecuali', 'keduanya', 'sama', 'sama', 'suka', 'dn', 'sama', 'sama', 'senang', 'bsa', 'di', 'terapkan', 'permennya', 'begitu', 'pak', 'terapkan', 'saja', 'asalkan', 'sesuai', 'dgn', 'kaedah', 'kaedah', 'hukum', 'dn', 'norma', 'norma', 'kesopanan', 'alias', 'jngan', 'di', 'pertontonkan']","['permendikbudristek', 'udah', 'terapkan', 'klu', 'pemaksaan', 'dn', 'kekerasan', 'alias', 'pemerkosaan', 'nggak', 'bsa', 'benarkan', 'terkecuali', 'suka', 'dn', 'senang', 'bsa', 'terapkan', 'permennya', 'terapkan', 'sesuai', 'kaedah', 'kaedah', 'hukum', 'dn', 'norma', 'norma', 'kesopanan', 'alias', 'jngan', 'pertontonkan']","['permendikbudristek', 'udah', 'terap', 'klu', 'paksa', 'dn', 'keras', 'alias', 'perkosa', 'nggak', 'bsa', 'benar', 'kecuali', 'suka', 'dn', 'senang', 'bsa', 'terap', 'permen', 'terap', 'sesuai', 'kaedah', 'kaedah', 'hukum', 'dn', 'norma', 'norma', 'sopan', 'alias', 'jngan', 'tonton']",permendikbudristek udah terap klu paksa dn keras alias perkosa nggak bsa benar kecuali suka dn senang bsa terap permen terap sesuai kaedah kaedah hukum dn norma norma sopan alias jngan tonton
248,hadeh bagai mana kalo akhirnya mereka jadi lgbt bukan gak mungkin asal tau aja bahkan di tempat sekelas pesantren aja banyak lgbt cuma diem diem aja ,negatif,"['hadeh', 'bagai', 'mana', 'kalo', 'ahirnya', 'mereka', 'jadi', 'lgbt', 'bukan', 'gak', 'mungkin', 'asal', 'tau', 'aja', 'bahkan', 'di', 'tempat', 'sekelas', 'pesantren', 'aja', 'byk', 'lgbt', 'cuma', 'diem', 'diem', 'aja']","['hadeh', 'ahirnya', 'lgbt', 'gak', 'sekelas', 'pesantren', 'byk', 'lgbt', 'diem', 'diem']","['hadeh', 'ahirnya', 'lgbt', 'gak', 'kelas', 'pesantren', 'byk', 'lgbt', 'diem', 'diem']",hadeh ahirnya lgbt gak kelas pesantren byk lgbt diem diem
249,mau tanya buktinya apa saya sendiri merasakannya teman saya di pesantren ada yang jadi belok karena tidak pernah melihat lawan jenis bahkan narapidana juga seprrti itu ,netral,"['mau', 'tanya', 'buktinya', 'aoa', 'aq', 'sendiri', 'merasakannya', 'teman', 'aq', 'di', 'pesantren', 'ada', 'yg', 'jadi', 'belok', 'krn', 'ndak', 'pernah', 'melihat', 'lawan', 'jenis', 'bahkan', 'narapidana', 'jga', 'seprrti', 'itu']","['buktinya', 'aoa', 'aq', 'merasakannya', 'teman', 'aq', 'pesantren', 'belok', 'ndak', 'lawan', 'jenis', 'narapidana', 'jga', 'seprrti']","['bukti', 'aoa', 'aq', 'rasa', 'teman', 'aq', 'pesantren', 'belok', 'ndak', 'lawan', 'jenis', 'narapidana', 'jga', 'seprrti']",bukti aoa aq rasa teman aq pesantren belok ndak lawan jenis narapidana jga seprrti
250, efek menteri asal comot gak jelas mungkin gak ada orang pandai di indonesia,netral,"['efek', 'mentri', 'asal', 'comot', 'gak', 'jelas', 'mungkin', 'gak', 'ada', 'org', 'pandai', 'di', 'indonesia']","['efek', 'mentri', 'comot', 'gak', 'gak', 'org', 'pandai', 'indonesia']","['efek', 'tri', 'comot', 'gak', 'gak', 'org', 'pandai', 'indonesia']",efek tri comot gak gak org pandai indonesia
